Job started on babel-9-7 at Fri Apr 11 15:01:59 EDT 2025
Job ID: 4547289
GPU information:
Fri Apr 11 15:01:59 2025       
+-----------------------------------------------------------------------------------------+
| NVIDIA-SMI 560.35.03              Driver Version: 560.35.03      CUDA Version: 12.6     |
|-----------------------------------------+------------------------+----------------------+
| GPU  Name                 Persistence-M | Bus-Id          Disp.A | Volatile Uncorr. ECC |
| Fan  Temp   Perf          Pwr:Usage/Cap |           Memory-Usage | GPU-Util  Compute M. |
|                                         |                        |               MIG M. |
|=========================================+========================+======================|
|   0  NVIDIA L40                     On  |   00000000:41:00.0 Off |                    0 |
| N/A   21C    P8             34W /  300W |       1MiB /  46068MiB |      0%      Default |
|                                         |                        |                  N/A |
+-----------------------------------------+------------------------+----------------------+
|   1  NVIDIA L40                     On  |   00000000:61:00.0 Off |                    0 |
| N/A   19C    P8             34W /  300W |       1MiB /  46068MiB |      0%      Default |
|                                         |                        |                  N/A |
+-----------------------------------------+------------------------+----------------------+
                                                                                         
+-----------------------------------------------------------------------------------------+
| Processes:                                                                              |
|  GPU   GI   CI        PID   Type   Process name                              GPU Memory |
|        ID   ID                                                               Usage      |
|=========================================================================================|
|  No running processes found                                                             |
+-----------------------------------------------------------------------------------------+
CUDA devices:
CUDA_VISIBLE_DEVICES: 0,1
Using device: cuda
[2025-04-11 15:02:04,300][root][INFO] - model:
  _target_: models.unet.UNet1d
  in_channels: 1
  out_channels: 1
  width: 32
dataset:
  reduced_batch: 1
  reduced_resolution: 2
  reduced_resolution_t: 4
  window_size: 15
  pde: burger_0.001
  data_path1: data/pdebench/1D_Burgers_Sols_Nu0.001.hdf5
training:
  batch_size: 64
  epochs: 100
  learning_rate: 0.001
  use_normalizer: false
project_name: ${dataset.pde}_${hydra:runtime.choices.model}
checkpoint_dir: checkpoints

Project name: burger_0.001_unet/unet_1d
Model name: models.unet.UNet1d
PDE Dataset: burger_0.001
Loading from file: /home/rvk/data/pdebench/1D_Burgers_Sols_Nu0.001.hdf5
(10000, 201, 1024)
Total data shape: (10000, 51, 512)
x shape: (490000, 1, 512)
y shape: (490000, 1, 512)
grid shape: torch.Size([512, 1])
---------Using data normalizer---------------
Train dataset size: 392000
Validation dataset size: 49000
Test dataset size: 49000
<class 'torch.Tensor'> 0.01628946326673031 0.016381528228521347 1.0935711860656738 1.0920053720474243
Sample Input shape: torch.Size([64, 1, 512])
Sample Output shape: torch.Size([64, 1, 512])
UNet1d(
  (encoder1): Sequential(
    (enc1conv1): Conv1d(1, 32, kernel_size=(3,), stride=(1,), padding=(1,), bias=False)
    (enc1norm1): BatchNorm1d(32, eps=1e-05, momentum=0.1, affine=True, track_running_stats=True)
    (enc1tanh1): Tanh()
    (enc1conv2): Conv1d(32, 32, kernel_size=(3,), stride=(1,), padding=(1,), bias=False)
    (enc1norm2): BatchNorm1d(32, eps=1e-05, momentum=0.1, affine=True, track_running_stats=True)
    (enc1tanh2): Tanh()
  )
  (pool1): MaxPool1d(kernel_size=2, stride=2, padding=0, dilation=1, ceil_mode=False)
  (encoder2): Sequential(
    (enc2conv1): Conv1d(32, 64, kernel_size=(3,), stride=(1,), padding=(1,), bias=False)
    (enc2norm1): BatchNorm1d(64, eps=1e-05, momentum=0.1, affine=True, track_running_stats=True)
    (enc2tanh1): Tanh()
    (enc2conv2): Conv1d(64, 64, kernel_size=(3,), stride=(1,), padding=(1,), bias=False)
    (enc2norm2): BatchNorm1d(64, eps=1e-05, momentum=0.1, affine=True, track_running_stats=True)
    (enc2tanh2): Tanh()
  )
  (pool2): MaxPool1d(kernel_size=2, stride=2, padding=0, dilation=1, ceil_mode=False)
  (encoder3): Sequential(
    (enc3conv1): Conv1d(64, 128, kernel_size=(3,), stride=(1,), padding=(1,), bias=False)
    (enc3norm1): BatchNorm1d(128, eps=1e-05, momentum=0.1, affine=True, track_running_stats=True)
    (enc3tanh1): Tanh()
    (enc3conv2): Conv1d(128, 128, kernel_size=(3,), stride=(1,), padding=(1,), bias=False)
    (enc3norm2): BatchNorm1d(128, eps=1e-05, momentum=0.1, affine=True, track_running_stats=True)
    (enc3tanh2): Tanh()
  )
  (pool3): MaxPool1d(kernel_size=2, stride=2, padding=0, dilation=1, ceil_mode=False)
  (encoder4): Sequential(
    (enc4conv1): Conv1d(128, 256, kernel_size=(3,), stride=(1,), padding=(1,), bias=False)
    (enc4norm1): BatchNorm1d(256, eps=1e-05, momentum=0.1, affine=True, track_running_stats=True)
    (enc4tanh1): Tanh()
    (enc4conv2): Conv1d(256, 256, kernel_size=(3,), stride=(1,), padding=(1,), bias=False)
    (enc4norm2): BatchNorm1d(256, eps=1e-05, momentum=0.1, affine=True, track_running_stats=True)
    (enc4tanh2): Tanh()
  )
  (pool4): MaxPool1d(kernel_size=2, stride=2, padding=0, dilation=1, ceil_mode=False)
  (bottleneck): Sequential(
    (bottleneckconv1): Conv1d(256, 512, kernel_size=(3,), stride=(1,), padding=(1,), bias=False)
    (bottlenecknorm1): BatchNorm1d(512, eps=1e-05, momentum=0.1, affine=True, track_running_stats=True)
    (bottlenecktanh1): Tanh()
    (bottleneckconv2): Conv1d(512, 512, kernel_size=(3,), stride=(1,), padding=(1,), bias=False)
    (bottlenecknorm2): BatchNorm1d(512, eps=1e-05, momentum=0.1, affine=True, track_running_stats=True)
    (bottlenecktanh2): Tanh()
  )
  (upconv4): ConvTranspose1d(512, 256, kernel_size=(2,), stride=(2,))
  (decoder4): Sequential(
    (dec4conv1): Conv1d(512, 256, kernel_size=(3,), stride=(1,), padding=(1,), bias=False)
    (dec4norm1): BatchNorm1d(256, eps=1e-05, momentum=0.1, affine=True, track_running_stats=True)
    (dec4tanh1): Tanh()
    (dec4conv2): Conv1d(256, 256, kernel_size=(3,), stride=(1,), padding=(1,), bias=False)
    (dec4norm2): BatchNorm1d(256, eps=1e-05, momentum=0.1, affine=True, track_running_stats=True)
    (dec4tanh2): Tanh()
  )
  (upconv3): ConvTranspose1d(256, 128, kernel_size=(2,), stride=(2,))
  (decoder3): Sequential(
    (dec3conv1): Conv1d(256, 128, kernel_size=(3,), stride=(1,), padding=(1,), bias=False)
    (dec3norm1): BatchNorm1d(128, eps=1e-05, momentum=0.1, affine=True, track_running_stats=True)
    (dec3tanh1): Tanh()
    (dec3conv2): Conv1d(128, 128, kernel_size=(3,), stride=(1,), padding=(1,), bias=False)
    (dec3norm2): BatchNorm1d(128, eps=1e-05, momentum=0.1, affine=True, track_running_stats=True)
    (dec3tanh2): Tanh()
  )
  (upconv2): ConvTranspose1d(128, 64, kernel_size=(2,), stride=(2,))
  (decoder2): Sequential(
    (dec2conv1): Conv1d(128, 64, kernel_size=(3,), stride=(1,), padding=(1,), bias=False)
    (dec2norm1): BatchNorm1d(64, eps=1e-05, momentum=0.1, affine=True, track_running_stats=True)
    (dec2tanh1): Tanh()
    (dec2conv2): Conv1d(64, 64, kernel_size=(3,), stride=(1,), padding=(1,), bias=False)
    (dec2norm2): BatchNorm1d(64, eps=1e-05, momentum=0.1, affine=True, track_running_stats=True)
    (dec2tanh2): Tanh()
  )
  (upconv1): ConvTranspose1d(64, 32, kernel_size=(2,), stride=(2,))
  (decoder1): Sequential(
    (dec1conv1): Conv1d(64, 32, kernel_size=(3,), stride=(1,), padding=(1,), bias=False)
    (dec1norm1): BatchNorm1d(32, eps=1e-05, momentum=0.1, affine=True, track_running_stats=True)
    (dec1tanh1): Tanh()
    (dec1conv2): Conv1d(32, 32, kernel_size=(3,), stride=(1,), padding=(1,), bias=False)
    (dec1norm2): BatchNorm1d(32, eps=1e-05, momentum=0.1, affine=True, track_running_stats=True)
    (dec1tanh2): Tanh()
  )
  (conv): Conv1d(32, 1, kernel_size=(1,), stride=(1,))
)
Epoch 0, Train Loss: 0.26685444, Val Loss: 0.18401077
Epoch 10, Train Loss: 0.09201587, Val Loss: 0.05058016
Epoch 20, Train Loss: 0.08200237, Val Loss: 0.04615093
Epoch 30, Train Loss: 0.04111131, Val Loss: 0.02906342
Epoch 40, Train Loss: 0.03206159, Val Loss: 0.03174971
Epoch 50, Train Loss: 0.02600606, Val Loss: 0.03234893
Epoch 60, Train Loss: 0.02198790, Val Loss: 0.03693879
Epoch 70, Train Loss: 0.01843356, Val Loss: 0.03078966
Epoch 80, Train Loss: 0.01630789, Val Loss: 0.01952391
Epoch 90, Train Loss: 0.01492737, Val Loss: 0.02530746
Test L2 Loss: 0.020081
-----Visualizing Saved------
Figure saved to output_logs/predictions/burger_0.001_fno_4547289_predictions.png
Model saved to checkpoints/unet1d/burger_0.001_4547289.pt
Original test data shape: x=torch.Size([49000, 1, 512]), y=torch.Size([49000, 1, 512])

Evaluating at resolution factor: 1
Resolution factor 1 - Relative L2 Loss: 0.020081

Evaluating at resolution factor: 2
Downsampled shapes: x=torch.Size([49000, 1, 256]), y=torch.Size([49000, 1, 256])
Resolution factor 2 - Relative L2 Loss: 0.173573

Evaluating at resolution factor: 4
Downsampled shapes: x=torch.Size([49000, 1, 128]), y=torch.Size([49000, 1, 128])
Resolution factor 4 - Relative L2 Loss: 0.306232

Evaluating at resolution factor: 8
Downsampled shapes: x=torch.Size([49000, 1, 64]), y=torch.Size([49000, 1, 64])
Resolution factor 8 - Relative L2 Loss: 0.479617

Evaluating at resolution factor: 16
Downsampled shapes: x=torch.Size([49000, 1, 32]), y=torch.Size([49000, 1, 32])
Resolution factor 16 - Relative L2 Loss: 0.704425

Evaluating at resolution factor: 32
Downsampled shapes: x=torch.Size([49000, 1, 16]), y=torch.Size([49000, 1, 16])
Resolution factor 32 - Relative L2 Loss: 0.695105

Summary of Super-Resolution Evaluation:
Resolution factor 1: Relative L2 Loss = 0.020081
Resolution factor 2: Relative L2 Loss = 0.173573
Resolution factor 4: Relative L2 Loss = 0.306232
Resolution factor 8: Relative L2 Loss = 0.479617
Resolution factor 16: Relative L2 Loss = 0.704425
Resolution factor 32: Relative L2 Loss = 0.695105
[1;34mwandb[0m: 
[1;34mwandb[0m: 🚀 View run [33mdesert-cherry-14[0m at: [34mhttps://wandb.ai/rohanvk-carnegie-mellon-university/unet1d/runs/pvkyp93c[0m
[1;34mwandb[0m: Find logs at: [1;35mwandb/run-20250411_150229-pvkyp93c/logs[0m
Job completed at Fri Apr 11 16:45:25 EDT 2025
