Job started on babel-6-25 at Tue Sep 23 03:59:32 EDT 2025
Job ID: 5566729
GPU information:
Tue Sep 23 03:59:32 2025       
+-----------------------------------------------------------------------------------------+
| NVIDIA-SMI 575.51.03              Driver Version: 575.51.03      CUDA Version: 12.9     |
|-----------------------------------------+------------------------+----------------------+
| GPU  Name                 Persistence-M | Bus-Id          Disp.A | Volatile Uncorr. ECC |
| Fan  Temp   Perf          Pwr:Usage/Cap |           Memory-Usage | GPU-Util  Compute M. |
|                                         |                        |               MIG M. |
|=========================================+========================+======================|
|   0  NVIDIA RTX A6000               On  |   00000000:02:00.0 Off |                  Off |
| 30%   42C    P8             23W /  300W |       1MiB /  49140MiB |      0%      Default |
|                                         |                        |                  N/A |
+-----------------------------------------+------------------------+----------------------+
|   1  NVIDIA RTX A6000               On  |   00000000:81:00.0 Off |                  Off |
| 30%   42C    P8             24W /  300W |       1MiB /  49140MiB |      0%      Default |
|                                         |                        |                  N/A |
+-----------------------------------------+------------------------+----------------------+
                                                                                         
+-----------------------------------------------------------------------------------------+
| Processes:                                                                              |
|  GPU   GI   CI              PID   Type   Process name                        GPU Memory |
|        ID   ID                                                               Usage      |
|=========================================================================================|
|  No running processes found                                                             |
+-----------------------------------------------------------------------------------------+
CUDA devices:
CUDA_VISIBLE_DEVICES: 0,1
Using device: cuda
[2025-09-23 03:59:54,178][root][INFO] - model:
  _target_: models.ffno.FFNO1D
  in_channels: 1
  out_channels: 1
  factor: 4
  n_modes: 64
  width: 128
  n_layers: 4
  ff_weight_norm: true
  n_ff_layers: 3
  layer_norm: true
  dropout: 0.2
  mode: full
  activation: gelu
  use_grid: true
dataset:
  dataset_params:
    _target_: dataloaders.burger_naive_true_multires.burger_true_multires_markov_dataset
    filename_pattern: 1D_Burgers_Sols_Nu*.hdf5
    saved_folder: /data/user_data/rvk/pdebench_gen/
    viscosity: 0.0001
    reduced_batch: 1
    reduced_resolution_t: 1
    data_mres_size:
      1024: 0
      512: 0
      256: 0
      128: 2000
    add_res:
    - 32
    - 64
    add_res_samples:
      64: 0
      32: 0
    downsample_from_res: 128
    data_normalizer: true
    normalization_type: simple
    num_samples_max: -1
    eval_dataset_target: dataloaders.burger_naive_markov.burger_markov_dataset
    eval_filename: 1D_Burgers_Sols_Nu0.0001.hdf5
    eval_saved_folder: /data/user_data/rvk/pdebench_gen/burgers_1024_0.0001/
  resize_to_train: false
  evaluation_type: naive_downsample
  window_size: 15
  original_res: 1024
  max_test_resolution: 1024
  train_mres: true
  pde: burger
training:
  batch_size: 16
  epochs: 100
  learning_rate: 0.001
  use_normalizer: false
project_name: ${dataset.pde}_${hydra:runtime.choices.model}
checkpoint_dir: checkpoints

Project name: burger_ffno_1d/ffno_1d
Model name: models.ffno.FFNO1D
PDE Dataset: burger
This is True Multi-Resolution Training. Train Resolution is the highest data resolution in the multi-resolution data
---------------------
Creating true multi-resolution dataset from /data/user_data/rvk/pdebench_gen/
Viscosity: 0.0001
Target samples per resolution (from files): {1024: 0, 512: 0, 256: 0, 128: 2000}
Additional downsampled resolutions: [32, 64]
Target samples per downsampled resolution: {64: 0, 32: 0}
Will downsample from resolution: 128
Loading multi-resolution data from /data/user_data/rvk/pdebench_gen/
Viscosity: 0.0001
Target samples per resolution (from files): {1024: 0, 512: 0, 256: 0, 128: 2000}
Additional downsampled resolutions: [32, 64]
Target samples per downsampled resolution: {64: 0, 32: 0}
Will downsample from resolution: 128
Loading resolution 128 from /data/user_data/rvk/pdebench_gen/burgers_128_0.0001/1D_Burgers_Sols_Nu0.0001.hdf5
  Original data shape for 128: (10000, 201, 128)
  After time reduction: (10000, 201, 128)
  Split 'train' data shape: (8000, 201, 128)
  Subsampled to 1600 samples for train split
  Added 318400 sample pairs from resolution 128
Adding downsampled resolutions: [32, 64]
Adding downsampled data from /data/user_data/rvk/pdebench_gen/burgers_128_0.0001/1D_Burgers_Sols_Nu0.0001.hdf5
  No downsampled samples allocated for train split at resolution 32
  No downsampled samples allocated for train split at resolution 64
Total samples loaded: 318400
Resolution distribution:
  128_file: 318400 samples
Sample x shapes: [(1, 128), (1, 128), (1, 128)]
Sample y shapes: [(1, 128), (1, 128), (1, 128)]
Loading multi-resolution data from /data/user_data/rvk/pdebench_gen/
Viscosity: 0.0001
Target samples per resolution (from files): {1024: 0, 512: 0, 256: 0, 128: 2000}
Additional downsampled resolutions: [32, 64]
Target samples per downsampled resolution: {64: 0, 32: 0}
Will downsample from resolution: 128
Loading resolution 128 from /data/user_data/rvk/pdebench_gen/burgers_128_0.0001/1D_Burgers_Sols_Nu0.0001.hdf5
  Original data shape for 128: (10000, 201, 128)
  After time reduction: (10000, 201, 128)
  Split 'val' data shape: (1000, 201, 128)
  Using all 1000 samples for val split
  Added 199000 sample pairs from resolution 128
Adding downsampled resolutions: [32, 64]
Adding downsampled data from /data/user_data/rvk/pdebench_gen/burgers_128_0.0001/1D_Burgers_Sols_Nu0.0001.hdf5
  No downsampled samples allocated for val split at resolution 32
  No downsampled samples allocated for val split at resolution 64
Total samples loaded: 199000
Resolution distribution:
  128_file: 199000 samples
Sample x shapes: [(1, 128), (1, 128), (1, 128)]
Sample y shapes: [(1, 128), (1, 128), (1, 128)]
Loading multi-resolution data from /data/user_data/rvk/pdebench_gen/
Viscosity: 0.0001
Target samples per resolution (from files): {1024: 0, 512: 0, 256: 0, 128: 2000}
Additional downsampled resolutions: [32, 64]
Target samples per downsampled resolution: {64: 0, 32: 0}
Will downsample from resolution: 128
Loading resolution 128 from /data/user_data/rvk/pdebench_gen/burgers_128_0.0001/1D_Burgers_Sols_Nu0.0001.hdf5
  Original data shape for 128: (10000, 201, 128)
  After time reduction: (10000, 201, 128)
  Split 'test' data shape: (1000, 201, 128)
  Using all 1000 samples for test split
  Added 199000 sample pairs from resolution 128
Adding downsampled resolutions: [32, 64]
Adding downsampled data from /data/user_data/rvk/pdebench_gen/burgers_128_0.0001/1D_Burgers_Sols_Nu0.0001.hdf5
  No downsampled samples allocated for test split at resolution 32
  No downsampled samples allocated for test split at resolution 64
Total samples loaded: 199000
Resolution distribution:
  128_file: 199000 samples
Sample x shapes: [(1, 128), (1, 128), (1, 128)]
Sample y shapes: [(1, 128), (1, 128), (1, 128)]

==================================================
CREATING ROLLOUT TEST DATASET
==================================================
Extracting Burgers test trajectories for rollout evaluation
Viscosity: 0.0001
Loading trajectories from resolution 128: /data/user_data/rvk/pdebench_gen/burgers_128_0.0001/1D_Burgers_Sols_Nu0.0001.hdf5
  Original data shape: (10000, 201, 128)
  After time reduction: (10000, 201, 128)
  Test split data shape: (1000, 201, 128)
  Using all 1000 test trajectories
  Extracted 1000 complete trajectories from resolution 128

Total extracted trajectories: 1000
Trajectory shapes: [torch.Size([201, 128]), torch.Size([201, 128]), torch.Size([201, 128])]
Resolution distribution:
  Resolution 128: 1000 trajectories
Rollout test dataset created with 1000 trajectories
---------Using simple global normalization---------------
Global statistics: X(mean=-0.038852, std=0.629048), Y(mean=-0.038852, std=0.627990)

Final dataset sizes:
Train dataset size: 318400
Validation dataset size: 199000
Test dataset size: 199000
Rollout test dataset size: 1000
<dataloaders.burger_naive_true_multires.burger_true_multires_markov_dataset.<locals>.SimpleNormalizedDataset object at 0x1493d7903890>
Created resolution groups:
  Resolution 128: 318400 samples
Created resolution groups:
  Resolution 128: 199000 samples
Created resolution groups:
  Resolution 128: 199000 samples
<class 'torch.Tensor'> 0.10089410841464996 0.10106408596038818 1.3224461078643799 1.3232035636901855
FFNO1D(
  (in_proj): WNLinear(in_features=1, out_features=128, bias=True)
  (fourier_layers): ModuleList(
    (0-3): 4 x FSpectralConv1d(
      (fourier_weight): ParameterList(  (0): Parameter containing: [torch.float32 of size 128x128x64x2 (cuda:0)])
      (backcast_ff): FeedForward(
        (layers): ModuleList(
          (0): Sequential(
            (0): Linear(in_features=128, out_features=512, bias=True)
            (1): Dropout(p=0.2, inplace=False)
            (2): GELU(approximate='none')
            (3): Identity()
          )
          (1): Sequential(
            (0): Linear(in_features=512, out_features=512, bias=True)
            (1): Dropout(p=0.2, inplace=False)
            (2): GELU(approximate='none')
            (3): Identity()
          )
          (2): Sequential(
            (0): Linear(in_features=512, out_features=128, bias=True)
            (1): Dropout(p=0.2, inplace=False)
            (2): Identity()
            (3): LayerNorm((128,), eps=1e-05, elementwise_affine=True)
          )
        )
      )
    )
  )
  (out_proj): WNLinear(in_features=128, out_features=1, bias=True)
)
Total Model Parameters: 9.97M
Trainable Parameters: 9.97M
Epoch 0, Train Loss: 0.01636100, Val Loss: 0.00731974
Epoch 10, Train Loss: 0.00184862, Val Loss: 0.00397600
Epoch 20, Train Loss: 0.00141560, Val Loss: 0.00099726
Epoch 30, Train Loss: 0.00115134, Val Loss: 0.00250230
Epoch 40, Train Loss: 0.00098399, Val Loss: 0.00080159
Epoch 50, Train Loss: 0.00080884, Val Loss: 0.00081188
Epoch 60, Train Loss: 0.00066177, Val Loss: 0.00055261
Epoch 70, Train Loss: 0.00054213, Val Loss: 0.00039912
Epoch 80, Train Loss: 0.00046165, Val Loss: 0.00036400
Epoch 90, Train Loss: 0.00042080, Val Loss: 0.00035443
Test L2 Loss: 0.000384
Model saved to checkpoints/ffno1d/burger_5566729.pt
Created/verified figures directory: figures/5566729
Evaluating BURGER model at multiple resolutions
Using normalizer from training resolution 1024
Testing resolutions: [32, 64, 128, 256, 512, 1024]
Loading from file: /data/user_data/rvk/pdebench_gen/burgers_1024_0.0001/1D_Burgers_Sols_Nu0.0001.hdf5
(10000, 201, 1024)
After downsampling data shape: (10000, 201, 32)
Total data shape: (10000, 201, 32)
x shape: (1990000, 1, 32)
y shape: (1990000, 1, 32)
grid shape: torch.Size([32, 1])

==================================================
CREATING ROLLOUT TEST DATASET
==================================================
Extracting Burgers test trajectories for rollout evaluation
File: 1D_Burgers_Sols_Nu0.0001.hdf5
Loading from file: /data/user_data/rvk/pdebench_gen/burgers_1024_0.0001/1D_Burgers_Sols_Nu0.0001.hdf5
Original data shape: (10000, 201, 1024)
After downsampling data shape: (10000, 201, 32)
Total data shape after sampling: (10000, 201, 32)
Test split data shape: (1000, 201, 32)
Extracted 1000 complete trajectories
Trajectory shapes: [torch.Size([201, 32]), torch.Size([201, 32]), torch.Size([201, 32])]
Rollout test dataset created with 1000 trajectories

Final dataset sizes:
Train dataset size: 1592000
Validation dataset size: 199000
Test dataset size: 199000
Rollout test dataset size: 1000
Selected random indices for plotting: [198948, 186627, 66562, 119061, 132304, 29734, 135277, 36655, 170632, 86725]
Collected 10 examples for resolution 32
Resolution 32 (downsample factor: 32) - Relative L2 Loss: 0.064505
Memory cleaned after resolution 32


Loading from file: /data/user_data/rvk/pdebench_gen/burgers_1024_0.0001/1D_Burgers_Sols_Nu0.0001.hdf5
(10000, 201, 1024)
After downsampling data shape: (10000, 201, 64)
Total data shape: (10000, 201, 64)
x shape: (1990000, 1, 64)
y shape: (1990000, 1, 64)
grid shape: torch.Size([64, 1])

==================================================
CREATING ROLLOUT TEST DATASET
==================================================
Extracting Burgers test trajectories for rollout evaluation
File: 1D_Burgers_Sols_Nu0.0001.hdf5
Loading from file: /data/user_data/rvk/pdebench_gen/burgers_1024_0.0001/1D_Burgers_Sols_Nu0.0001.hdf5
Original data shape: (10000, 201, 1024)
After downsampling data shape: (10000, 201, 64)
Total data shape after sampling: (10000, 201, 64)
Test split data shape: (1000, 201, 64)
Extracted 1000 complete trajectories
Trajectory shapes: [torch.Size([201, 64]), torch.Size([201, 64]), torch.Size([201, 64])]
Rollout test dataset created with 1000 trajectories

Final dataset sizes:
Train dataset size: 1592000
Validation dataset size: 199000
Test dataset size: 199000
Rollout test dataset size: 1000
Collected 10 examples for resolution 64
Resolution 64 (downsample factor: 16) - Relative L2 Loss: 0.052887
Memory cleaned after resolution 64


Loading from file: /data/user_data/rvk/pdebench_gen/burgers_1024_0.0001/1D_Burgers_Sols_Nu0.0001.hdf5
(10000, 201, 1024)
After downsampling data shape: (10000, 201, 128)
Total data shape: (10000, 201, 128)
x shape: (1990000, 1, 128)
y shape: (1990000, 1, 128)
grid shape: torch.Size([128, 1])

==================================================
CREATING ROLLOUT TEST DATASET
==================================================
Extracting Burgers test trajectories for rollout evaluation
File: 1D_Burgers_Sols_Nu0.0001.hdf5
Loading from file: /data/user_data/rvk/pdebench_gen/burgers_1024_0.0001/1D_Burgers_Sols_Nu0.0001.hdf5
Original data shape: (10000, 201, 1024)
After downsampling data shape: (10000, 201, 128)
Total data shape after sampling: (10000, 201, 128)
Test split data shape: (1000, 201, 128)
Extracted 1000 complete trajectories
Trajectory shapes: [torch.Size([201, 128]), torch.Size([201, 128]), torch.Size([201, 128])]
Rollout test dataset created with 1000 trajectories

Final dataset sizes:
Train dataset size: 1592000
Validation dataset size: 199000
Test dataset size: 199000
Rollout test dataset size: 1000
Collected 10 examples for resolution 128
Resolution 128 (downsample factor: 8) - Relative L2 Loss: 0.041523
Memory cleaned after resolution 128


Loading from file: /data/user_data/rvk/pdebench_gen/burgers_1024_0.0001/1D_Burgers_Sols_Nu0.0001.hdf5
(10000, 201, 1024)
After downsampling data shape: (10000, 201, 256)
Total data shape: (10000, 201, 256)
x shape: (1990000, 1, 256)
y shape: (1990000, 1, 256)
grid shape: torch.Size([256, 1])

==================================================
CREATING ROLLOUT TEST DATASET
==================================================
Extracting Burgers test trajectories for rollout evaluation
File: 1D_Burgers_Sols_Nu0.0001.hdf5
Loading from file: /data/user_data/rvk/pdebench_gen/burgers_1024_0.0001/1D_Burgers_Sols_Nu0.0001.hdf5
Original data shape: (10000, 201, 1024)
After downsampling data shape: (10000, 201, 256)
Total data shape after sampling: (10000, 201, 256)
Test split data shape: (1000, 201, 256)
Extracted 1000 complete trajectories
Trajectory shapes: [torch.Size([201, 256]), torch.Size([201, 256]), torch.Size([201, 256])]
Rollout test dataset created with 1000 trajectories

Final dataset sizes:
Train dataset size: 1592000
Validation dataset size: 199000
Test dataset size: 199000
Rollout test dataset size: 1000
Collected 10 examples for resolution 256
Resolution 256 (downsample factor: 4) - Relative L2 Loss: 0.038255
Memory cleaned after resolution 256


Loading from file: /data/user_data/rvk/pdebench_gen/burgers_1024_0.0001/1D_Burgers_Sols_Nu0.0001.hdf5
(10000, 201, 1024)
After downsampling data shape: (10000, 201, 512)
Total data shape: (10000, 201, 512)
x shape: (1990000, 1, 512)
y shape: (1990000, 1, 512)
grid shape: torch.Size([512, 1])

==================================================
CREATING ROLLOUT TEST DATASET
==================================================
Extracting Burgers test trajectories for rollout evaluation
File: 1D_Burgers_Sols_Nu0.0001.hdf5
Loading from file: /data/user_data/rvk/pdebench_gen/burgers_1024_0.0001/1D_Burgers_Sols_Nu0.0001.hdf5
Original data shape: (10000, 201, 1024)
After downsampling data shape: (10000, 201, 512)
Total data shape after sampling: (10000, 201, 512)
Test split data shape: (1000, 201, 512)
Extracted 1000 complete trajectories
Trajectory shapes: [torch.Size([201, 512]), torch.Size([201, 512]), torch.Size([201, 512])]
Rollout test dataset created with 1000 trajectories

Final dataset sizes:
Train dataset size: 1592000
Validation dataset size: 199000
Test dataset size: 199000
Rollout test dataset size: 1000
Collected 10 examples for resolution 512
Resolution 512 (downsample factor: 2) - Relative L2 Loss: 0.039946
Memory cleaned after resolution 512


Loading from file: /data/user_data/rvk/pdebench_gen/burgers_1024_0.0001/1D_Burgers_Sols_Nu0.0001.hdf5
(10000, 201, 1024)
After downsampling data shape: (10000, 201, 1024)
Total data shape: (10000, 201, 1024)
x shape: (1990000, 1, 1024)
y shape: (1990000, 1, 1024)
grid shape: torch.Size([1024, 1])

==================================================
CREATING ROLLOUT TEST DATASET
==================================================
Extracting Burgers test trajectories for rollout evaluation
File: 1D_Burgers_Sols_Nu0.0001.hdf5
Loading from file: /data/user_data/rvk/pdebench_gen/burgers_1024_0.0001/1D_Burgers_Sols_Nu0.0001.hdf5
Original data shape: (10000, 201, 1024)
After downsampling data shape: (10000, 201, 1024)
Total data shape after sampling: (10000, 201, 1024)
Test split data shape: (1000, 201, 1024)
Extracted 1000 complete trajectories
Trajectory shapes: [torch.Size([201, 1024]), torch.Size([201, 1024]), torch.Size([201, 1024])]
Rollout test dataset created with 1000 trajectories

Final dataset sizes:
Train dataset size: 1592000
Validation dataset size: 199000
Test dataset size: 199000
Rollout test dataset size: 1000
Collected 10 examples for resolution 1024
Resolution 1024 (downsample factor: 1) - Relative L2 Loss: 0.040318
Memory cleaned after resolution 1024


Creating prediction vs target plots...
Saved prediction plot: figures/5566729/prediction_plots/burger_predictions_vs_targets_10_examples.png
Saved numerical results: figures/5566729/burger_1d_evaluation_results_20250923_122745.csv
Saved summary: figures/5566729/burger_1d_evaluation_summary_20250923_122745.txt

==================================================
BURGER EVALUATION SUMMARY
==================================================
Resolution  32: 0.064505
Resolution  64: 0.052887
Resolution 128: 0.041523
Resolution 256: 0.038255
Resolution 512: 0.039946
Resolution 1024: 0.040318
[1;34mwandb[0m: 
[1;34mwandb[0m: 🚀 View run [33mworldly-bush-398[0m at: [34mhttps://wandb.ai/rohanvk-carnegie-mellon-university/ffno1d/runs/7o6mislb[0m
[1;34mwandb[0m: Find logs at: [1;35mwandb/run-20250923_040112-7o6mislb/logs[0m
Job completed at Tue Sep 23 12:27:51 EDT 2025
