Job started on babel-0-31 at Tue Apr 15 11:40:01 EDT 2025
Job ID: 4574456
GPU information:
Tue Apr 15 11:40:01 2025       
+-----------------------------------------------------------------------------------------+
| NVIDIA-SMI 560.35.03              Driver Version: 560.35.03      CUDA Version: 12.6     |
|-----------------------------------------+------------------------+----------------------+
| GPU  Name                 Persistence-M | Bus-Id          Disp.A | Volatile Uncorr. ECC |
| Fan  Temp   Perf          Pwr:Usage/Cap |           Memory-Usage | GPU-Util  Compute M. |
|                                         |                        |               MIG M. |
|=========================================+========================+======================|
|   0  NVIDIA RTX A6000               On  |   00000000:01:00.0 Off |                  Off |
| 30%   41C    P8             27W /  204W |       2MiB /  49140MiB |      0%      Default |
|                                         |                        |                  N/A |
+-----------------------------------------+------------------------+----------------------+
|   1  NVIDIA RTX A6000               On  |   00000000:25:00.0 Off |                  Off |
| 30%   40C    P8             22W /  204W |       2MiB /  49140MiB |      0%      Default |
|                                         |                        |                  N/A |
+-----------------------------------------+------------------------+----------------------+
                                                                                         
+-----------------------------------------------------------------------------------------+
| Processes:                                                                              |
|  GPU   GI   CI        PID   Type   Process name                              GPU Memory |
|        ID   ID                                                               Usage      |
|=========================================================================================|
|  No running processes found                                                             |
+-----------------------------------------------------------------------------------------+
CUDA devices:
CUDA_VISIBLE_DEVICES: 0,1
Using device: cuda
[2025-04-15 11:40:06,341][root][INFO] - model:
  _target_: models.ffno.FFNO1D
  in_channels: 1
  out_channels: 1
  width: 32
  n_modes: 16
  factor: 4
  n_layers: 4
  ff_weight_norm: true
  n_ff_layers: 2
  layer_norm: false
  grid: null
  dropout: 0.0
  mode: full
dataset:
  reduced_batch: 1
  reduced_resolution: 8
  reduced_resolution_t: 4
  window_size: 15
  original_res: 1024
  current_res: 128
  pde:
  - burger_0.001
  - burger_0.01
  - burger_0.1
  - burger_1.0
  - burger_2.0
  - burger_4.0
  data_path1:
  - data/pdebench/1D_Burgers_Sols_Nu0.001.hdf5
  - data/pdebench/1D_Burgers_Sols_Nu0.01.hdf5
  - data/pdebench/1D_Burgers_Sols_Nu0.1.hdf5
  - data/pdebench/1D_Burgers_Sols_Nu1.0.hdf5
  - data/pdebench/1D_Burgers_Sols_Nu2.0.hdf5
  - data/pdebench/1D_Burgers_Sols_Nu4.0.hdf5
  test_id:
  - 4500986
  - 4500987
  - 4500988
  - 4500990
  - 4500991
  - 4500992
training:
  batch_size: 64
  epochs: 100
  learning_rate: 0.001
  use_normalizer: false
project_name: ${dataset.pde}_${hydra:runtime.choices.model}
checkpoint_dir: checkpoints

Project name: ['burger_0.001', 'burger_0.01', 'burger_0.1', 'burger_1.0', 'burger_2.0', 'burger_4.0']_ffno_1d/ffno_1d
Model name: models.ffno.FFNO1D
PDE Dataset: ['burger_0.001', 'burger_0.01', 'burger_0.1', 'burger_1.0', 'burger_2.0', 'burger_4.0']
FFNO1D(
  (in_proj): WNLinear(in_features=2, out_features=32, bias=True)
  (fourier_layers): ModuleList(
    (0-3): 4 x FSpectralConv1d(
      (fourier_weight): ParameterList(  (0): Parameter containing: [torch.float32 of size 32x32x16x2 (cuda:0)])
      (backcast_ff): FeedForward(
        (layers): ModuleList(
          (0): Sequential(
            (0): Linear(in_features=32, out_features=128, bias=True)
            (1): Dropout(p=0.0, inplace=False)
            (2): GELU(approximate='none')
            (3): Identity()
          )
          (1): Sequential(
            (0): Linear(in_features=128, out_features=32, bias=True)
            (1): Dropout(p=0.0, inplace=False)
            (2): Identity()
            (3): Identity()
          )
        )
      )
      (act): Identity()
    )
  )
  (out_proj): WNLinear(in_features=32, out_features=1, bias=True)
)
----------------------------------------------------------
Evaluating job_id:4500986
Loading data path: data/pdebench/1D_Burgers_Sols_Nu0.001.hdf5
Loading model path: ./checkpoints/ffno1d/burger_0.001_4500986.pt
----------------------------------------------------------
Loading from file: /home/rvk/data/pdebench/1D_Burgers_Sols_Nu0.001.hdf5
(10000, 201, 1024)
Total data shape: (10000, 51, 1024)
x shape: (490000, 1, 1024)
y shape: (490000, 1, 1024)
grid shape: torch.Size([1024, 1])
---------Using data normalizer---------------
Train dataset size: 392000
Validation dataset size: 49000
Test dataset size: 49000
Original test data shape: x=torch.Size([49000, 1, 1024]), y=torch.Size([49000, 1, 1024])
Testing resolutions: [256, 512, 1024]

Evaluating at resolution: 256
Downsampled shapes: x=torch.Size([49000, 1, 256]), y=torch.Size([49000, 1, 256])
Resolution 256 - Relative L2 Loss: 0.006068

Evaluating at resolution: 512
Downsampled shapes: x=torch.Size([49000, 1, 512]), y=torch.Size([49000, 1, 512])
Resolution 512 - Relative L2 Loss: 0.005425

Evaluating at resolution: 1024
Downsampled shapes: x=torch.Size([49000, 1, 1024]), y=torch.Size([49000, 1, 1024])
Resolution 1024 - Relative L2 Loss: 0.031103
----------------------------------------------------------
Evaluating job_id:4500987
Loading data path: data/pdebench/1D_Burgers_Sols_Nu0.01.hdf5
Loading model path: ./checkpoints/ffno1d/burger_0.01_4500987.pt
----------------------------------------------------------
Loading from file: /home/rvk/data/pdebench/1D_Burgers_Sols_Nu0.01.hdf5
(10000, 201, 1024)
Total data shape: (10000, 51, 1024)
x shape: (490000, 1, 1024)
y shape: (490000, 1, 1024)
grid shape: torch.Size([1024, 1])
---------Using data normalizer---------------
Train dataset size: 392000
Validation dataset size: 49000
Test dataset size: 49000
Original test data shape: x=torch.Size([49000, 1, 1024]), y=torch.Size([49000, 1, 1024])
Testing resolutions: [256, 512, 1024]

Evaluating at resolution: 256
Downsampled shapes: x=torch.Size([49000, 1, 256]), y=torch.Size([49000, 1, 256])
Resolution 256 - Relative L2 Loss: 0.001828

Evaluating at resolution: 512
Downsampled shapes: x=torch.Size([49000, 1, 512]), y=torch.Size([49000, 1, 512])
Resolution 512 - Relative L2 Loss: 0.001828

Evaluating at resolution: 1024
Downsampled shapes: x=torch.Size([49000, 1, 1024]), y=torch.Size([49000, 1, 1024])
Resolution 1024 - Relative L2 Loss: 0.094464
----------------------------------------------------------
Evaluating job_id:4500988
Loading data path: data/pdebench/1D_Burgers_Sols_Nu0.1.hdf5
Loading model path: ./checkpoints/ffno1d/burger_0.1_4500988.pt
----------------------------------------------------------
Loading from file: /home/rvk/data/pdebench/1D_Burgers_Sols_Nu0.1.hdf5
(10000, 201, 1024)
Total data shape: (10000, 51, 1024)
x shape: (490000, 1, 1024)
y shape: (490000, 1, 1024)
grid shape: torch.Size([1024, 1])
---------Using data normalizer---------------
Train dataset size: 392000
Validation dataset size: 49000
Test dataset size: 49000
Original test data shape: x=torch.Size([49000, 1, 1024]), y=torch.Size([49000, 1, 1024])
Testing resolutions: [256, 512, 1024]

Evaluating at resolution: 256
Downsampled shapes: x=torch.Size([49000, 1, 256]), y=torch.Size([49000, 1, 256])
Resolution 256 - Relative L2 Loss: 0.000856

Evaluating at resolution: 512
Downsampled shapes: x=torch.Size([49000, 1, 512]), y=torch.Size([49000, 1, 512])
Resolution 512 - Relative L2 Loss: 0.000855

Evaluating at resolution: 1024
Downsampled shapes: x=torch.Size([49000, 1, 1024]), y=torch.Size([49000, 1, 1024])
Resolution 1024 - Relative L2 Loss: 0.012860
----------------------------------------------------------
Evaluating job_id:4500990
Loading data path: data/pdebench/1D_Burgers_Sols_Nu1.0.hdf5
Loading model path: ./checkpoints/ffno1d/burger_1.0_4500990.pt
----------------------------------------------------------
Loading from file: /home/rvk/data/pdebench/1D_Burgers_Sols_Nu1.0.hdf5
(10000, 201, 1024)
Total data shape: (10000, 51, 1024)
x shape: (490000, 1, 1024)
y shape: (490000, 1, 1024)
grid shape: torch.Size([1024, 1])
---------Using data normalizer---------------
Train dataset size: 392000
Validation dataset size: 49000
Test dataset size: 49000
Original test data shape: x=torch.Size([49000, 1, 1024]), y=torch.Size([49000, 1, 1024])
Testing resolutions: [256, 512, 1024]

Evaluating at resolution: 256
Downsampled shapes: x=torch.Size([49000, 1, 256]), y=torch.Size([49000, 1, 256])
Resolution 256 - Relative L2 Loss: 0.000493

Evaluating at resolution: 512
Downsampled shapes: x=torch.Size([49000, 1, 512]), y=torch.Size([49000, 1, 512])
Resolution 512 - Relative L2 Loss: 0.000494

Evaluating at resolution: 1024
Downsampled shapes: x=torch.Size([49000, 1, 1024]), y=torch.Size([49000, 1, 1024])
Resolution 1024 - Relative L2 Loss: 0.005208
----------------------------------------------------------
Evaluating job_id:4500991
Loading data path: data/pdebench/1D_Burgers_Sols_Nu2.0.hdf5
Loading model path: ./checkpoints/ffno1d/burger_2.0_4500991.pt
----------------------------------------------------------
Loading from file: /home/rvk/data/pdebench/1D_Burgers_Sols_Nu2.0.hdf5
(10000, 201, 1024)
Total data shape: (10000, 51, 1024)
x shape: (490000, 1, 1024)
y shape: (490000, 1, 1024)
grid shape: torch.Size([1024, 1])
---------Using data normalizer---------------
Train dataset size: 392000
Validation dataset size: 49000
Test dataset size: 49000
Original test data shape: x=torch.Size([49000, 1, 1024]), y=torch.Size([49000, 1, 1024])
Testing resolutions: [256, 512, 1024]

Evaluating at resolution: 256
Downsampled shapes: x=torch.Size([49000, 1, 256]), y=torch.Size([49000, 1, 256])
Resolution 256 - Relative L2 Loss: 0.000527

Evaluating at resolution: 512
Downsampled shapes: x=torch.Size([49000, 1, 512]), y=torch.Size([49000, 1, 512])
Resolution 512 - Relative L2 Loss: 0.000527

Evaluating at resolution: 1024
Downsampled shapes: x=torch.Size([49000, 1, 1024]), y=torch.Size([49000, 1, 1024])
Resolution 1024 - Relative L2 Loss: 0.000804
----------------------------------------------------------
Evaluating job_id:4500992
Loading data path: data/pdebench/1D_Burgers_Sols_Nu4.0.hdf5
Loading model path: ./checkpoints/ffno1d/burger_4.0_4500992.pt
----------------------------------------------------------
Loading from file: /home/rvk/data/pdebench/1D_Burgers_Sols_Nu4.0.hdf5
(10000, 201, 1024)
Total data shape: (10000, 51, 1024)
x shape: (490000, 1, 1024)
y shape: (490000, 1, 1024)
grid shape: torch.Size([1024, 1])
---------Using data normalizer---------------
Train dataset size: 392000
Validation dataset size: 49000
Test dataset size: 49000
Original test data shape: x=torch.Size([49000, 1, 1024]), y=torch.Size([49000, 1, 1024])
Testing resolutions: [256, 512, 1024]

Evaluating at resolution: 256
Downsampled shapes: x=torch.Size([49000, 1, 256]), y=torch.Size([49000, 1, 256])
Resolution 256 - Relative L2 Loss: 0.000250

Evaluating at resolution: 512
Downsampled shapes: x=torch.Size([49000, 1, 512]), y=torch.Size([49000, 1, 512])
Resolution 512 - Relative L2 Loss: 0.000250

Evaluating at resolution: 1024
Downsampled shapes: x=torch.Size([49000, 1, 1024]), y=torch.Size([49000, 1, 1024])
Resolution 1024 - Relative L2 Loss: 0.001211

Summary of Higher-Resolution Evaluation:
Resolution 256: Relative L2 Loss = 0.000250
Resolution 512: Relative L2 Loss = 0.000250
Resolution 1024: Relative L2 Loss = 0.001211
[1;34mwandb[0m: 
[1;34mwandb[0m: 🚀 View run [33mexalted-sound-6[0m at: [34mhttps://wandb.ai/rohanvk-carnegie-mellon-university/FFNO%20Test%20Resolution/runs/k9olfdjd[0m
[1;34mwandb[0m: Find logs at: [1;35mwandb/run-20250415_114008-k9olfdjd/logs[0m
Job completed at Tue Apr 15 11:42:09 EDT 2025
