Job started on babel-1-23 at Sun Apr 13 07:47:19 EDT 2025
Job ID: 4558676
GPU information:
Sun Apr 13 07:47:19 2025       
+-----------------------------------------------------------------------------------------+
| NVIDIA-SMI 560.35.03              Driver Version: 560.35.03      CUDA Version: 12.6     |
|-----------------------------------------+------------------------+----------------------+
| GPU  Name                 Persistence-M | Bus-Id          Disp.A | Volatile Uncorr. ECC |
| Fan  Temp   Perf          Pwr:Usage/Cap |           Memory-Usage | GPU-Util  Compute M. |
|                                         |                        |               MIG M. |
|=========================================+========================+======================|
|   0  NVIDIA RTX A6000               On  |   00000000:41:00.0 Off |                  Off |
| 30%   32C    P8             20W /  204W |       2MiB /  49140MiB |      0%      Default |
|                                         |                        |                  N/A |
+-----------------------------------------+------------------------+----------------------+
|   1  NVIDIA RTX A6000               On  |   00000000:A1:00.0 Off |                  Off |
| 30%   31C    P8             19W /  204W |       2MiB /  49140MiB |      0%      Default |
|                                         |                        |                  N/A |
+-----------------------------------------+------------------------+----------------------+
                                                                                         
+-----------------------------------------------------------------------------------------+
| Processes:                                                                              |
|  GPU   GI   CI        PID   Type   Process name                              GPU Memory |
|        ID   ID                                                               Usage      |
|=========================================================================================|
|  No running processes found                                                             |
+-----------------------------------------------------------------------------------------+
CUDA devices:
CUDA_VISIBLE_DEVICES: 0,1
Using device: cuda
[2025-04-13 07:47:24,750][root][INFO] - model:
  _target_: models.unet.UNet1d
  in_channels: 1
  out_channels: 1
  width: 32
dataset:
  reduced_batch: 1
  reduced_resolution: 16
  reduced_resolution_t: 4
  window_size: 15
  original_res: 1024
  pde: burger_0.001
  data_path1: data/pdebench/1D_Burgers_Sols_Nu0.001.hdf5
training:
  batch_size: 64
  epochs: 100
  learning_rate: 0.001
  use_normalizer: false
project_name: ${dataset.pde}_${hydra:runtime.choices.model}
checkpoint_dir: checkpoints

Project name: burger_0.001_unet/unet_1d
Model name: models.unet.UNet1d
PDE Dataset: burger_0.001
Loading from file: /home/rvk/data/pdebench/1D_Burgers_Sols_Nu0.001.hdf5
(10000, 201, 1024)
Total data shape: (10000, 51, 64)
x shape: (490000, 1, 64)
y shape: (490000, 1, 64)
grid shape: torch.Size([64, 1])
---------Using data normalizer---------------
Train dataset size: 392000
Validation dataset size: 49000
Test dataset size: 49000
<class 'torch.Tensor'> 0.14217831194400787 0.14423681795597076 0.9661736488342285 0.9680471420288086
Sample Input shape: torch.Size([64, 1, 64])
Sample Output shape: torch.Size([64, 1, 64])
UNet1d(
  (encoder1): Sequential(
    (enc1conv1): Conv1d(1, 32, kernel_size=(3,), stride=(1,), padding=(1,), bias=False)
    (enc1norm1): BatchNorm1d(32, eps=1e-05, momentum=0.1, affine=True, track_running_stats=True)
    (enc1tanh1): Tanh()
    (enc1conv2): Conv1d(32, 32, kernel_size=(3,), stride=(1,), padding=(1,), bias=False)
    (enc1norm2): BatchNorm1d(32, eps=1e-05, momentum=0.1, affine=True, track_running_stats=True)
    (enc1tanh2): Tanh()
  )
  (pool1): MaxPool1d(kernel_size=2, stride=2, padding=0, dilation=1, ceil_mode=False)
  (encoder2): Sequential(
    (enc2conv1): Conv1d(32, 64, kernel_size=(3,), stride=(1,), padding=(1,), bias=False)
    (enc2norm1): BatchNorm1d(64, eps=1e-05, momentum=0.1, affine=True, track_running_stats=True)
    (enc2tanh1): Tanh()
    (enc2conv2): Conv1d(64, 64, kernel_size=(3,), stride=(1,), padding=(1,), bias=False)
    (enc2norm2): BatchNorm1d(64, eps=1e-05, momentum=0.1, affine=True, track_running_stats=True)
    (enc2tanh2): Tanh()
  )
  (pool2): MaxPool1d(kernel_size=2, stride=2, padding=0, dilation=1, ceil_mode=False)
  (encoder3): Sequential(
    (enc3conv1): Conv1d(64, 128, kernel_size=(3,), stride=(1,), padding=(1,), bias=False)
    (enc3norm1): BatchNorm1d(128, eps=1e-05, momentum=0.1, affine=True, track_running_stats=True)
    (enc3tanh1): Tanh()
    (enc3conv2): Conv1d(128, 128, kernel_size=(3,), stride=(1,), padding=(1,), bias=False)
    (enc3norm2): BatchNorm1d(128, eps=1e-05, momentum=0.1, affine=True, track_running_stats=True)
    (enc3tanh2): Tanh()
  )
  (pool3): MaxPool1d(kernel_size=2, stride=2, padding=0, dilation=1, ceil_mode=False)
  (encoder4): Sequential(
    (enc4conv1): Conv1d(128, 256, kernel_size=(3,), stride=(1,), padding=(1,), bias=False)
    (enc4norm1): BatchNorm1d(256, eps=1e-05, momentum=0.1, affine=True, track_running_stats=True)
    (enc4tanh1): Tanh()
    (enc4conv2): Conv1d(256, 256, kernel_size=(3,), stride=(1,), padding=(1,), bias=False)
    (enc4norm2): BatchNorm1d(256, eps=1e-05, momentum=0.1, affine=True, track_running_stats=True)
    (enc4tanh2): Tanh()
  )
  (pool4): MaxPool1d(kernel_size=2, stride=2, padding=0, dilation=1, ceil_mode=False)
  (bottleneck): Sequential(
    (bottleneckconv1): Conv1d(256, 512, kernel_size=(3,), stride=(1,), padding=(1,), bias=False)
    (bottlenecknorm1): BatchNorm1d(512, eps=1e-05, momentum=0.1, affine=True, track_running_stats=True)
    (bottlenecktanh1): Tanh()
    (bottleneckconv2): Conv1d(512, 512, kernel_size=(3,), stride=(1,), padding=(1,), bias=False)
    (bottlenecknorm2): BatchNorm1d(512, eps=1e-05, momentum=0.1, affine=True, track_running_stats=True)
    (bottlenecktanh2): Tanh()
  )
  (upconv4): ConvTranspose1d(512, 256, kernel_size=(2,), stride=(2,))
  (decoder4): Sequential(
    (dec4conv1): Conv1d(512, 256, kernel_size=(3,), stride=(1,), padding=(1,), bias=False)
    (dec4norm1): BatchNorm1d(256, eps=1e-05, momentum=0.1, affine=True, track_running_stats=True)
    (dec4tanh1): Tanh()
    (dec4conv2): Conv1d(256, 256, kernel_size=(3,), stride=(1,), padding=(1,), bias=False)
    (dec4norm2): BatchNorm1d(256, eps=1e-05, momentum=0.1, affine=True, track_running_stats=True)
    (dec4tanh2): Tanh()
  )
  (upconv3): ConvTranspose1d(256, 128, kernel_size=(2,), stride=(2,))
  (decoder3): Sequential(
    (dec3conv1): Conv1d(256, 128, kernel_size=(3,), stride=(1,), padding=(1,), bias=False)
    (dec3norm1): BatchNorm1d(128, eps=1e-05, momentum=0.1, affine=True, track_running_stats=True)
    (dec3tanh1): Tanh()
    (dec3conv2): Conv1d(128, 128, kernel_size=(3,), stride=(1,), padding=(1,), bias=False)
    (dec3norm2): BatchNorm1d(128, eps=1e-05, momentum=0.1, affine=True, track_running_stats=True)
    (dec3tanh2): Tanh()
  )
  (upconv2): ConvTranspose1d(128, 64, kernel_size=(2,), stride=(2,))
  (decoder2): Sequential(
    (dec2conv1): Conv1d(128, 64, kernel_size=(3,), stride=(1,), padding=(1,), bias=False)
    (dec2norm1): BatchNorm1d(64, eps=1e-05, momentum=0.1, affine=True, track_running_stats=True)
    (dec2tanh1): Tanh()
    (dec2conv2): Conv1d(64, 64, kernel_size=(3,), stride=(1,), padding=(1,), bias=False)
    (dec2norm2): BatchNorm1d(64, eps=1e-05, momentum=0.1, affine=True, track_running_stats=True)
    (dec2tanh2): Tanh()
  )
  (upconv1): ConvTranspose1d(64, 32, kernel_size=(2,), stride=(2,))
  (decoder1): Sequential(
    (dec1conv1): Conv1d(64, 32, kernel_size=(3,), stride=(1,), padding=(1,), bias=False)
    (dec1norm1): BatchNorm1d(32, eps=1e-05, momentum=0.1, affine=True, track_running_stats=True)
    (dec1tanh1): Tanh()
    (dec1conv2): Conv1d(32, 32, kernel_size=(3,), stride=(1,), padding=(1,), bias=False)
    (dec1norm2): BatchNorm1d(32, eps=1e-05, momentum=0.1, affine=True, track_running_stats=True)
    (dec1tanh2): Tanh()
  )
  (conv): Conv1d(32, 1, kernel_size=(1,), stride=(1,))
)
Epoch 0, Train Loss: 0.21023890, Val Loss: 0.08764592
Epoch 10, Train Loss: 0.09602186, Val Loss: 0.05370294
Epoch 20, Train Loss: 0.08499913, Val Loss: 0.05366898
Epoch 30, Train Loss: 0.07855962, Val Loss: 0.04554054
Epoch 40, Train Loss: 0.07451408, Val Loss: 0.03563751
Epoch 50, Train Loss: 0.06234847, Val Loss: 0.03131568
Epoch 60, Train Loss: 0.05096092, Val Loss: 0.03532843
Epoch 70, Train Loss: 0.04366299, Val Loss: 0.02941454
Epoch 80, Train Loss: 0.03949322, Val Loss: 0.03859981
Epoch 90, Train Loss: 0.03706074, Val Loss: 0.02763223
Test L2 Loss: 0.028230
-----Visualizing Saved------
Figure saved to output_logs/predictions/burger_0.001_fno_4558676_predictions.png
Model saved to checkpoints/unet1d/burger_0.001_4558676.pt
Original test data shape: x=torch.Size([49000, 1, 64]), y=torch.Size([49000, 1, 64])

Evaluating at resolution factor: 1
Resolution factor 1 - Relative L2 Loss: 0.028230

Evaluating at resolution factor: 2
Downsampled shapes: x=torch.Size([49000, 1, 32]), y=torch.Size([49000, 1, 32])
Resolution factor 2 - Relative L2 Loss: 0.139343

Evaluating at resolution factor: 4
Downsampled shapes: x=torch.Size([49000, 1, 16]), y=torch.Size([49000, 1, 16])
Resolution factor 4 - Relative L2 Loss: 0.236629

Evaluating at resolution factor: 8
Downsampled shapes: x=torch.Size([49000, 1, 8]), y=torch.Size([49000, 1, 8])
Skipping Resolution factor 8 because not enough modes

Evaluating at resolution factor: 16
Downsampled shapes: x=torch.Size([49000, 1, 4]), y=torch.Size([49000, 1, 4])
Skipping Resolution factor 16 because not enough modes

Evaluating at resolution factor: 32
Downsampled shapes: x=torch.Size([49000, 1, 2]), y=torch.Size([49000, 1, 2])
Skipping Resolution factor 32 because not enough modes
Loading from file: /home/rvk/data/pdebench/1D_Burgers_Sols_Nu0.001.hdf5
(10000, 201, 1024)
Total data shape: (10000, 51, 1024)
x shape: (490000, 1, 1024)
y shape: (490000, 1, 1024)
grid shape: torch.Size([1024, 1])
---------Using data normalizer---------------
Train dataset size: 392000
Validation dataset size: 49000
Test dataset size: 49000
Original test data shape: x=torch.Size([49000, 1, 1024]), y=torch.Size([49000, 1, 1024])
Testing resolutions: [128, 256, 512, 1024]

Evaluating at resolution: 128
Downsampled shapes: x=torch.Size([49000, 1, 128]), y=torch.Size([49000, 1, 128])
Resolution 128 - Relative L2 Loss: 0.105545

Evaluating at resolution: 256
Downsampled shapes: x=torch.Size([49000, 1, 256]), y=torch.Size([49000, 1, 256])
Resolution 256 - Relative L2 Loss: 0.137790

Evaluating at resolution: 512
Downsampled shapes: x=torch.Size([49000, 1, 512]), y=torch.Size([49000, 1, 512])
Resolution 512 - Relative L2 Loss: 0.150630

Evaluating at resolution: 1024
Downsampled shapes: x=torch.Size([49000, 1, 1024]), y=torch.Size([49000, 1, 1024])
Resolution 1024 - Relative L2 Loss: 0.155778

Summary of Super-Resolution Evaluation:
Resolution factor 1: Relative L2 Loss = 0.028230
Resolution factor 2: Relative L2 Loss = 0.139343
Resolution factor 4: Relative L2 Loss = 0.236629

Summary of Higher-Resolution Evaluation:
Resolution factor 128: Relative L2 Loss = 0.105545
Resolution factor 256: Relative L2 Loss = 0.137790
Resolution factor 512: Relative L2 Loss = 0.150630
Resolution factor 1024: Relative L2 Loss = 0.155778
[1;34mwandb[0m: 
[1;34mwandb[0m: 🚀 View run [33mastral-wildflower-32[0m at: [34mhttps://wandb.ai/rohanvk-carnegie-mellon-university/unet1d/runs/scpooid3[0m
[1;34mwandb[0m: Find logs at: [1;35mwandb/run-20250413_074736-scpooid3/logs[0m
Job completed at Sun Apr 13 09:23:03 EDT 2025
