Job started on babel-5-31 at Fri Apr 11 01:17:05 EDT 2025
Job ID: 4545526
GPU information:
Fri Apr 11 01:17:05 2025       
+-----------------------------------------------------------------------------------------+
| NVIDIA-SMI 560.35.03              Driver Version: 560.35.03      CUDA Version: 12.6     |
|-----------------------------------------+------------------------+----------------------+
| GPU  Name                 Persistence-M | Bus-Id          Disp.A | Volatile Uncorr. ECC |
| Fan  Temp   Perf          Pwr:Usage/Cap |           Memory-Usage | GPU-Util  Compute M. |
|                                         |                        |               MIG M. |
|=========================================+========================+======================|
|   0  NVIDIA A100 80GB PCIe          On  |   00000000:01:00.0 Off |                    0 |
| N/A   45C    P0             58W /  204W |       1MiB /  81920MiB |      0%      Default |
|                                         |                        |             Disabled |
+-----------------------------------------+------------------------+----------------------+
|   1  NVIDIA A100 80GB PCIe          On  |   00000000:25:00.0 Off |                    0 |
| N/A   45C    P0             61W /  204W |       1MiB /  81920MiB |      0%      Default |
|                                         |                        |             Disabled |
+-----------------------------------------+------------------------+----------------------+
                                                                                         
+-----------------------------------------------------------------------------------------+
| Processes:                                                                              |
|  GPU   GI   CI        PID   Type   Process name                              GPU Memory |
|        ID   ID                                                               Usage      |
|=========================================================================================|
|  No running processes found                                                             |
+-----------------------------------------------------------------------------------------+
CUDA devices:
CUDA_VISIBLE_DEVICES: 0,1
Using device: cuda
[2025-04-11 01:17:10,713][root][INFO] - model:
  _target_: models.unet.UNet1d
  in_channels: 1
  out_channels: 1
  width: 32
dataset:
  reduced_batch: 1
  reduced_resolution: 1
  reduced_resolution_t: 4
  window_size: 15
  pde: burger_0.001
  data_path1: data/pdebench/1D_Burgers_Sols_Nu0.001.hdf5
training:
  batch_size: 64
  epochs: 100
  learning_rate: 0.001
  use_normalizer: false
project_name: ${dataset.pde}_${hydra:runtime.choices.model}
checkpoint_dir: checkpoints

Project name: burger_0.001_unet/unet_1d
Model name: models.unet.UNet1d
PDE Dataset: burger_0.001
Loading from file: /home/rvk/data/pdebench/1D_Burgers_Sols_Nu0.001.hdf5
(10000, 201, 1024)
Total data shape: (10000, 51, 1024)
x shape: (490000, 1, 1024)
y shape: (490000, 1, 1024)
grid shape: torch.Size([1024, 1])
---------Using data normalizer---------------
Train dataset size: 392000
Validation dataset size: 49000
Test dataset size: 49000
<class 'torch.Tensor'> 0.04143034666776657 0.041689857840538025 0.9723976254463196 0.9746154546737671
Sample Input shape: torch.Size([64, 1, 1024])
Sample Output shape: torch.Size([64, 1, 1024])
UNet1d(
  (encoder1): Sequential(
    (enc1conv1): Conv1d(1, 32, kernel_size=(3,), stride=(1,), padding=(1,), bias=False)
    (enc1norm1): BatchNorm1d(32, eps=1e-05, momentum=0.1, affine=True, track_running_stats=True)
    (enc1tanh1): Tanh()
    (enc1conv2): Conv1d(32, 32, kernel_size=(3,), stride=(1,), padding=(1,), bias=False)
    (enc1norm2): BatchNorm1d(32, eps=1e-05, momentum=0.1, affine=True, track_running_stats=True)
    (enc1tanh2): Tanh()
  )
  (pool1): MaxPool1d(kernel_size=2, stride=2, padding=0, dilation=1, ceil_mode=False)
  (encoder2): Sequential(
    (enc2conv1): Conv1d(32, 64, kernel_size=(3,), stride=(1,), padding=(1,), bias=False)
    (enc2norm1): BatchNorm1d(64, eps=1e-05, momentum=0.1, affine=True, track_running_stats=True)
    (enc2tanh1): Tanh()
    (enc2conv2): Conv1d(64, 64, kernel_size=(3,), stride=(1,), padding=(1,), bias=False)
    (enc2norm2): BatchNorm1d(64, eps=1e-05, momentum=0.1, affine=True, track_running_stats=True)
    (enc2tanh2): Tanh()
  )
  (pool2): MaxPool1d(kernel_size=2, stride=2, padding=0, dilation=1, ceil_mode=False)
  (encoder3): Sequential(
    (enc3conv1): Conv1d(64, 128, kernel_size=(3,), stride=(1,), padding=(1,), bias=False)
    (enc3norm1): BatchNorm1d(128, eps=1e-05, momentum=0.1, affine=True, track_running_stats=True)
    (enc3tanh1): Tanh()
    (enc3conv2): Conv1d(128, 128, kernel_size=(3,), stride=(1,), padding=(1,), bias=False)
    (enc3norm2): BatchNorm1d(128, eps=1e-05, momentum=0.1, affine=True, track_running_stats=True)
    (enc3tanh2): Tanh()
  )
  (pool3): MaxPool1d(kernel_size=2, stride=2, padding=0, dilation=1, ceil_mode=False)
  (encoder4): Sequential(
    (enc4conv1): Conv1d(128, 256, kernel_size=(3,), stride=(1,), padding=(1,), bias=False)
    (enc4norm1): BatchNorm1d(256, eps=1e-05, momentum=0.1, affine=True, track_running_stats=True)
    (enc4tanh1): Tanh()
    (enc4conv2): Conv1d(256, 256, kernel_size=(3,), stride=(1,), padding=(1,), bias=False)
    (enc4norm2): BatchNorm1d(256, eps=1e-05, momentum=0.1, affine=True, track_running_stats=True)
    (enc4tanh2): Tanh()
  )
  (pool4): MaxPool1d(kernel_size=2, stride=2, padding=0, dilation=1, ceil_mode=False)
  (bottleneck): Sequential(
    (bottleneckconv1): Conv1d(256, 512, kernel_size=(3,), stride=(1,), padding=(1,), bias=False)
    (bottlenecknorm1): BatchNorm1d(512, eps=1e-05, momentum=0.1, affine=True, track_running_stats=True)
    (bottlenecktanh1): Tanh()
    (bottleneckconv2): Conv1d(512, 512, kernel_size=(3,), stride=(1,), padding=(1,), bias=False)
    (bottlenecknorm2): BatchNorm1d(512, eps=1e-05, momentum=0.1, affine=True, track_running_stats=True)
    (bottlenecktanh2): Tanh()
  )
  (upconv4): ConvTranspose1d(512, 256, kernel_size=(2,), stride=(2,))
  (decoder4): Sequential(
    (dec4conv1): Conv1d(512, 256, kernel_size=(3,), stride=(1,), padding=(1,), bias=False)
    (dec4norm1): BatchNorm1d(256, eps=1e-05, momentum=0.1, affine=True, track_running_stats=True)
    (dec4tanh1): Tanh()
    (dec4conv2): Conv1d(256, 256, kernel_size=(3,), stride=(1,), padding=(1,), bias=False)
    (dec4norm2): BatchNorm1d(256, eps=1e-05, momentum=0.1, affine=True, track_running_stats=True)
    (dec4tanh2): Tanh()
  )
  (upconv3): ConvTranspose1d(256, 128, kernel_size=(2,), stride=(2,))
  (decoder3): Sequential(
    (dec3conv1): Conv1d(256, 128, kernel_size=(3,), stride=(1,), padding=(1,), bias=False)
    (dec3norm1): BatchNorm1d(128, eps=1e-05, momentum=0.1, affine=True, track_running_stats=True)
    (dec3tanh1): Tanh()
    (dec3conv2): Conv1d(128, 128, kernel_size=(3,), stride=(1,), padding=(1,), bias=False)
    (dec3norm2): BatchNorm1d(128, eps=1e-05, momentum=0.1, affine=True, track_running_stats=True)
    (dec3tanh2): Tanh()
  )
  (upconv2): ConvTranspose1d(128, 64, kernel_size=(2,), stride=(2,))
  (decoder2): Sequential(
    (dec2conv1): Conv1d(128, 64, kernel_size=(3,), stride=(1,), padding=(1,), bias=False)
    (dec2norm1): BatchNorm1d(64, eps=1e-05, momentum=0.1, affine=True, track_running_stats=True)
    (dec2tanh1): Tanh()
    (dec2conv2): Conv1d(64, 64, kernel_size=(3,), stride=(1,), padding=(1,), bias=False)
    (dec2norm2): BatchNorm1d(64, eps=1e-05, momentum=0.1, affine=True, track_running_stats=True)
    (dec2tanh2): Tanh()
  )
  (upconv1): ConvTranspose1d(64, 32, kernel_size=(2,), stride=(2,))
  (decoder1): Sequential(
    (dec1conv1): Conv1d(64, 32, kernel_size=(3,), stride=(1,), padding=(1,), bias=False)
    (dec1norm1): BatchNorm1d(32, eps=1e-05, momentum=0.1, affine=True, track_running_stats=True)
    (dec1tanh1): Tanh()
    (dec1conv2): Conv1d(32, 32, kernel_size=(3,), stride=(1,), padding=(1,), bias=False)
    (dec1norm2): BatchNorm1d(32, eps=1e-05, momentum=0.1, affine=True, track_running_stats=True)
    (dec1tanh2): Tanh()
  )
  (conv): Conv1d(32, 1, kernel_size=(1,), stride=(1,))
)
Epoch 0, Train Loss: 0.28962606, Val Loss: 0.20838620
Epoch 10, Train Loss: 0.08970493, Val Loss: 0.03757404
Epoch 20, Train Loss: 0.06268015, Val Loss: 0.04590559
Epoch 30, Train Loss: 0.03925616, Val Loss: 0.02372429
Epoch 40, Train Loss: 0.03074837, Val Loss: 0.04249044
Epoch 50, Train Loss: 0.02521663, Val Loss: 0.01686790
Epoch 60, Train Loss: 0.02123813, Val Loss: 0.03457458
Epoch 70, Train Loss: 0.01791308, Val Loss: 0.03405187
Epoch 80, Train Loss: 0.01580945, Val Loss: 0.03642545
Epoch 90, Train Loss: 0.01437711, Val Loss: 0.02598797
Test L2 Loss: 0.021580
-----Visualizing Saved------
Figure saved to output_logs/predictions/burger_0.001_fno_4545526_predictions.png
Model saved to checkpoints/unet1d/burger_0.001_4545526.pt
Original test data shape: x=torch.Size([49000, 1, 1024]), y=torch.Size([49000, 1, 1024])

Evaluating at resolution factor: 1
Resolution factor 1 - Relative L2 Loss: 0.021580

Evaluating at resolution factor: 2
Downsampled shapes: x=torch.Size([49000, 1, 512]), y=torch.Size([49000, 1, 512])
Resolution factor 2 - Relative L2 Loss: 0.148827

Evaluating at resolution factor: 4
Downsampled shapes: x=torch.Size([49000, 1, 256]), y=torch.Size([49000, 1, 256])
Resolution factor 4 - Relative L2 Loss: 0.257171

Evaluating at resolution factor: 8
Downsampled shapes: x=torch.Size([49000, 1, 128]), y=torch.Size([49000, 1, 128])
Resolution factor 8 - Relative L2 Loss: 0.343362

Evaluating at resolution factor: 16
Downsampled shapes: x=torch.Size([49000, 1, 64]), y=torch.Size([49000, 1, 64])
Resolution factor 16 - Relative L2 Loss: 0.400608

Evaluating at resolution factor: 32
Downsampled shapes: x=torch.Size([49000, 1, 32]), y=torch.Size([49000, 1, 32])
Resolution factor 32 - Relative L2 Loss: 0.449323

Summary of Super-Resolution Evaluation:
Resolution factor 1: Relative L2 Loss = 0.021580
Resolution factor 2: Relative L2 Loss = 0.148827
Resolution factor 4: Relative L2 Loss = 0.257171
Resolution factor 8: Relative L2 Loss = 0.343362
Resolution factor 16: Relative L2 Loss = 0.400608
Resolution factor 32: Relative L2 Loss = 0.449323
[1;34mwandb[0m: 
[1;34mwandb[0m: 🚀 View run [33mrural-jazz-8[0m at: [34mhttps://wandb.ai/rohanvk-carnegie-mellon-university/unet1d/runs/k6n7j1mp[0m
[1;34mwandb[0m: Find logs at: [1;35mwandb/run-20250411_011736-k6n7j1mp/logs[0m
Job completed at Fri Apr 11 03:06:39 EDT 2025
