Job started on babel-5-19 at Tue Apr 15 11:47:18 EDT 2025
Job ID: 4574473
GPU information:
Tue Apr 15 11:47:18 2025       
+-----------------------------------------------------------------------------------------+
| NVIDIA-SMI 560.35.03              Driver Version: 560.35.03      CUDA Version: 12.6     |
|-----------------------------------------+------------------------+----------------------+
| GPU  Name                 Persistence-M | Bus-Id          Disp.A | Volatile Uncorr. ECC |
| Fan  Temp   Perf          Pwr:Usage/Cap |           Memory-Usage | GPU-Util  Compute M. |
|                                         |                        |               MIG M. |
|=========================================+========================+======================|
|   0  NVIDIA RTX 6000 Ada Gene...    On  |   00000000:45:00.0 Off |                  Off |
| 30%   35C    P8             27W /  204W |       2MiB /  49140MiB |      0%      Default |
|                                         |                        |                  N/A |
+-----------------------------------------+------------------------+----------------------+
|   1  NVIDIA RTX 6000 Ada Gene...    On  |   00000000:46:00.0 Off |                  Off |
| 30%   34C    P8             26W /  204W |       2MiB /  49140MiB |      0%      Default |
|                                         |                        |                  N/A |
+-----------------------------------------+------------------------+----------------------+
                                                                                         
+-----------------------------------------------------------------------------------------+
| Processes:                                                                              |
|  GPU   GI   CI        PID   Type   Process name                              GPU Memory |
|        ID   ID                                                               Usage      |
|=========================================================================================|
|  No running processes found                                                             |
+-----------------------------------------------------------------------------------------+
CUDA devices:
CUDA_VISIBLE_DEVICES: 0,1
Using device: cuda
[2025-04-15 11:47:22,961][root][INFO] - model:
  _target_: models.ffno.FFNO1D
  in_channels: 1
  out_channels: 1
  width: 32
  n_modes: 16
  factor: 4
  n_layers: 4
  ff_weight_norm: true
  n_ff_layers: 2
  layer_norm: false
  grid: null
  dropout: 0.0
  mode: full
dataset:
  reduced_batch: 1
  reduced_resolution: 16
  reduced_resolution_t: 4
  window_size: 15
  original_res: 1024
  current_res: 64
  pde:
  - burger_0.001
  - burger_0.01
  - burger_0.1
  - burger_1.0
  - burger_2.0
  - burger_4.0
  data_path1:
  - data/pdebench/1D_Burgers_Sols_Nu0.001.hdf5
  - data/pdebench/1D_Burgers_Sols_Nu0.01.hdf5
  - data/pdebench/1D_Burgers_Sols_Nu0.1.hdf5
  - data/pdebench/1D_Burgers_Sols_Nu1.0.hdf5
  - data/pdebench/1D_Burgers_Sols_Nu2.0.hdf5
  - data/pdebench/1D_Burgers_Sols_Nu4.0.hdf5
  test_id:
  - 4509529
  - 4509531
  - 4509532
  - 4544899
  - 4544909
  - 4509537
training:
  batch_size: 64
  epochs: 100
  learning_rate: 0.001
  use_normalizer: false
project_name: ${dataset.pde}_${hydra:runtime.choices.model}
checkpoint_dir: checkpoints

Project name: ['burger_0.001', 'burger_0.01', 'burger_0.1', 'burger_1.0', 'burger_2.0', 'burger_4.0']_ffno_1d/ffno_1d
Model name: models.ffno.FFNO1D
PDE Dataset: ['burger_0.001', 'burger_0.01', 'burger_0.1', 'burger_1.0', 'burger_2.0', 'burger_4.0']
FFNO1D(
  (in_proj): WNLinear(in_features=2, out_features=32, bias=True)
  (fourier_layers): ModuleList(
    (0-3): 4 x FSpectralConv1d(
      (fourier_weight): ParameterList(  (0): Parameter containing: [torch.float32 of size 32x32x16x2 (cuda:0)])
      (backcast_ff): FeedForward(
        (layers): ModuleList(
          (0): Sequential(
            (0): Linear(in_features=32, out_features=128, bias=True)
            (1): Dropout(p=0.0, inplace=False)
            (2): GELU(approximate='none')
            (3): Identity()
          )
          (1): Sequential(
            (0): Linear(in_features=128, out_features=32, bias=True)
            (1): Dropout(p=0.0, inplace=False)
            (2): Identity()
            (3): Identity()
          )
        )
      )
      (act): Identity()
    )
  )
  (out_proj): WNLinear(in_features=32, out_features=1, bias=True)
)
----------------------------------------------------------
Evaluating job_id:4509529
Loading data path: data/pdebench/1D_Burgers_Sols_Nu0.001.hdf5
Loading model path: ./checkpoints/ffno1d/burger_0.001_4509529.pt
----------------------------------------------------------
Loading from file: /home/rvk/data/pdebench/1D_Burgers_Sols_Nu0.001.hdf5
(10000, 201, 1024)
Total data shape: (10000, 51, 1024)
x shape: (490000, 1, 1024)
y shape: (490000, 1, 1024)
grid shape: torch.Size([1024, 1])
---------Using data normalizer---------------
Train dataset size: 392000
Validation dataset size: 49000
Test dataset size: 49000
Original test data shape: x=torch.Size([49000, 1, 1024]), y=torch.Size([49000, 1, 1024])
Testing resolutions: [128, 256, 512, 1024]

Evaluating at resolution: 128
Downsampled shapes: x=torch.Size([49000, 1, 128]), y=torch.Size([49000, 1, 128])
Resolution 128 - Relative L2 Loss: 0.028525

Evaluating at resolution: 256
Downsampled shapes: x=torch.Size([49000, 1, 256]), y=torch.Size([49000, 1, 256])
Resolution 256 - Relative L2 Loss: 0.018936

Evaluating at resolution: 512
Downsampled shapes: x=torch.Size([49000, 1, 512]), y=torch.Size([49000, 1, 512])
Resolution 512 - Relative L2 Loss: 0.019234

Evaluating at resolution: 1024
Downsampled shapes: x=torch.Size([49000, 1, 1024]), y=torch.Size([49000, 1, 1024])
Resolution 1024 - Relative L2 Loss: 0.034562
----------------------------------------------------------
Evaluating job_id:4509531
Loading data path: data/pdebench/1D_Burgers_Sols_Nu0.01.hdf5
Loading model path: ./checkpoints/ffno1d/burger_0.01_4509531.pt
----------------------------------------------------------
Loading from file: /home/rvk/data/pdebench/1D_Burgers_Sols_Nu0.01.hdf5
(10000, 201, 1024)
Total data shape: (10000, 51, 1024)
x shape: (490000, 1, 1024)
y shape: (490000, 1, 1024)
grid shape: torch.Size([1024, 1])
---------Using data normalizer---------------
Train dataset size: 392000
Validation dataset size: 49000
Test dataset size: 49000
Original test data shape: x=torch.Size([49000, 1, 1024]), y=torch.Size([49000, 1, 1024])
Testing resolutions: [128, 256, 512, 1024]

Evaluating at resolution: 128
Downsampled shapes: x=torch.Size([49000, 1, 128]), y=torch.Size([49000, 1, 128])
Resolution 128 - Relative L2 Loss: 0.001862

Evaluating at resolution: 256
Downsampled shapes: x=torch.Size([49000, 1, 256]), y=torch.Size([49000, 1, 256])
Resolution 256 - Relative L2 Loss: 0.001863

Evaluating at resolution: 512
Downsampled shapes: x=torch.Size([49000, 1, 512]), y=torch.Size([49000, 1, 512])
Resolution 512 - Relative L2 Loss: 0.001864

Evaluating at resolution: 1024
Downsampled shapes: x=torch.Size([49000, 1, 1024]), y=torch.Size([49000, 1, 1024])
Resolution 1024 - Relative L2 Loss: 0.009819
----------------------------------------------------------
Evaluating job_id:4509532
Loading data path: data/pdebench/1D_Burgers_Sols_Nu0.1.hdf5
Loading model path: ./checkpoints/ffno1d/burger_0.1_4509532.pt
----------------------------------------------------------
Loading from file: /home/rvk/data/pdebench/1D_Burgers_Sols_Nu0.1.hdf5
(10000, 201, 1024)
Total data shape: (10000, 51, 1024)
x shape: (490000, 1, 1024)
y shape: (490000, 1, 1024)
grid shape: torch.Size([1024, 1])
---------Using data normalizer---------------
Train dataset size: 392000
Validation dataset size: 49000
Test dataset size: 49000
Original test data shape: x=torch.Size([49000, 1, 1024]), y=torch.Size([49000, 1, 1024])
Testing resolutions: [128, 256, 512, 1024]

Evaluating at resolution: 128
Downsampled shapes: x=torch.Size([49000, 1, 128]), y=torch.Size([49000, 1, 128])
Resolution 128 - Relative L2 Loss: 0.000857

Evaluating at resolution: 256
Downsampled shapes: x=torch.Size([49000, 1, 256]), y=torch.Size([49000, 1, 256])
Resolution 256 - Relative L2 Loss: 0.000856

Evaluating at resolution: 512
Downsampled shapes: x=torch.Size([49000, 1, 512]), y=torch.Size([49000, 1, 512])
Resolution 512 - Relative L2 Loss: 0.000856

Evaluating at resolution: 1024
Downsampled shapes: x=torch.Size([49000, 1, 1024]), y=torch.Size([49000, 1, 1024])
Resolution 1024 - Relative L2 Loss: 0.005234
----------------------------------------------------------
Evaluating job_id:4544899
Loading data path: data/pdebench/1D_Burgers_Sols_Nu1.0.hdf5
Loading model path: ./checkpoints/ffno1d/burger_1.0_4544899.pt
----------------------------------------------------------
Loading from file: /home/rvk/data/pdebench/1D_Burgers_Sols_Nu1.0.hdf5
(10000, 201, 1024)
Total data shape: (10000, 51, 1024)
x shape: (490000, 1, 1024)
y shape: (490000, 1, 1024)
grid shape: torch.Size([1024, 1])
---------Using data normalizer---------------
Train dataset size: 392000
Validation dataset size: 49000
Test dataset size: 49000
Original test data shape: x=torch.Size([49000, 1, 1024]), y=torch.Size([49000, 1, 1024])
Testing resolutions: [128, 256, 512, 1024]

Evaluating at resolution: 128
Downsampled shapes: x=torch.Size([49000, 1, 128]), y=torch.Size([49000, 1, 128])
Resolution 128 - Relative L2 Loss: 0.000606

Evaluating at resolution: 256
Downsampled shapes: x=torch.Size([49000, 1, 256]), y=torch.Size([49000, 1, 256])
Resolution 256 - Relative L2 Loss: 0.000608

Evaluating at resolution: 512
Downsampled shapes: x=torch.Size([49000, 1, 512]), y=torch.Size([49000, 1, 512])
Resolution 512 - Relative L2 Loss: 0.000609

Evaluating at resolution: 1024
Downsampled shapes: x=torch.Size([49000, 1, 1024]), y=torch.Size([49000, 1, 1024])
Resolution 1024 - Relative L2 Loss: 0.025789
----------------------------------------------------------
Evaluating job_id:4544909
Loading data path: data/pdebench/1D_Burgers_Sols_Nu2.0.hdf5
Loading model path: ./checkpoints/ffno1d/burger_2.0_4544909.pt
----------------------------------------------------------
Loading from file: /home/rvk/data/pdebench/1D_Burgers_Sols_Nu2.0.hdf5
(10000, 201, 1024)
Total data shape: (10000, 51, 1024)
x shape: (490000, 1, 1024)
y shape: (490000, 1, 1024)
grid shape: torch.Size([1024, 1])
---------Using data normalizer---------------
Train dataset size: 392000
Validation dataset size: 49000
Test dataset size: 49000
Original test data shape: x=torch.Size([49000, 1, 1024]), y=torch.Size([49000, 1, 1024])
Testing resolutions: [128, 256, 512, 1024]

Evaluating at resolution: 128
Downsampled shapes: x=torch.Size([49000, 1, 128]), y=torch.Size([49000, 1, 128])
Resolution 128 - Relative L2 Loss: 0.000482

Evaluating at resolution: 256
Downsampled shapes: x=torch.Size([49000, 1, 256]), y=torch.Size([49000, 1, 256])
Resolution 256 - Relative L2 Loss: 0.000483

Evaluating at resolution: 512
Downsampled shapes: x=torch.Size([49000, 1, 512]), y=torch.Size([49000, 1, 512])
Resolution 512 - Relative L2 Loss: 0.000484

Evaluating at resolution: 1024
Downsampled shapes: x=torch.Size([49000, 1, 1024]), y=torch.Size([49000, 1, 1024])
Resolution 1024 - Relative L2 Loss: 0.002888
----------------------------------------------------------
Evaluating job_id:4509537
Loading data path: data/pdebench/1D_Burgers_Sols_Nu4.0.hdf5
Loading model path: ./checkpoints/ffno1d/burger_4.0_4509537.pt
----------------------------------------------------------
Loading from file: /home/rvk/data/pdebench/1D_Burgers_Sols_Nu4.0.hdf5
(10000, 201, 1024)
Total data shape: (10000, 51, 1024)
x shape: (490000, 1, 1024)
y shape: (490000, 1, 1024)
grid shape: torch.Size([1024, 1])
---------Using data normalizer---------------
Train dataset size: 392000
Validation dataset size: 49000
Test dataset size: 49000
Original test data shape: x=torch.Size([49000, 1, 1024]), y=torch.Size([49000, 1, 1024])
Testing resolutions: [128, 256, 512, 1024]

Evaluating at resolution: 128
Downsampled shapes: x=torch.Size([49000, 1, 128]), y=torch.Size([49000, 1, 128])
Resolution 128 - Relative L2 Loss: 0.000178

Evaluating at resolution: 256
Downsampled shapes: x=torch.Size([49000, 1, 256]), y=torch.Size([49000, 1, 256])
Resolution 256 - Relative L2 Loss: 0.000178

Evaluating at resolution: 512
Downsampled shapes: x=torch.Size([49000, 1, 512]), y=torch.Size([49000, 1, 512])
Resolution 512 - Relative L2 Loss: 0.000177

Evaluating at resolution: 1024
Downsampled shapes: x=torch.Size([49000, 1, 1024]), y=torch.Size([49000, 1, 1024])
Resolution 1024 - Relative L2 Loss: 0.005133

Summary of Higher-Resolution Evaluation:
Resolution 128: Relative L2 Loss = 0.000178
Resolution 256: Relative L2 Loss = 0.000178
Resolution 512: Relative L2 Loss = 0.000177
Resolution 1024: Relative L2 Loss = 0.005133
[1;34mwandb[0m: 
[1;34mwandb[0m: 🚀 View run [33molive-thunder-7[0m at: [34mhttps://wandb.ai/rohanvk-carnegie-mellon-university/FFNO%20Test%20Resolution/runs/rprlodk6[0m
[1;34mwandb[0m: Find logs at: [1;35mwandb/run-20250415_114725-rprlodk6/logs[0m
Job completed at Tue Apr 15 11:50:01 EDT 2025
