Job started on babel-0-35 at Sun Sep 21 17:51:57 EDT 2025
Job ID: 5562044
GPU information:
Sun Sep 21 17:51:57 2025       
+-----------------------------------------------------------------------------------------+
| NVIDIA-SMI 575.51.03              Driver Version: 575.51.03      CUDA Version: 12.9     |
|-----------------------------------------+------------------------+----------------------+
| GPU  Name                 Persistence-M | Bus-Id          Disp.A | Volatile Uncorr. ECC |
| Fan  Temp   Perf          Pwr:Usage/Cap |           Memory-Usage | GPU-Util  Compute M. |
|                                         |                        |               MIG M. |
|=========================================+========================+======================|
|   0  NVIDIA RTX A6000               On  |   00000000:17:00.0 Off |                  Off |
| 47%   63C    P8             73W /  300W |       1MiB /  49140MiB |      0%      Default |
|                                         |                        |                  N/A |
+-----------------------------------------+------------------------+----------------------+
|   1  NVIDIA RTX A6000               On  |   00000000:B1:00.0 Off |                  Off |
| 30%   48C    P8             30W /  300W |       1MiB /  49140MiB |      0%      Default |
|                                         |                        |                  N/A |
+-----------------------------------------+------------------------+----------------------+
                                                                                         
+-----------------------------------------------------------------------------------------+
| Processes:                                                                              |
|  GPU   GI   CI              PID   Type   Process name                        GPU Memory |
|        ID   ID                                                               Usage      |
|=========================================================================================|
|  No running processes found                                                             |
+-----------------------------------------------------------------------------------------+
CUDA devices:
CUDA_VISIBLE_DEVICES: 0,1
Using device: cuda
[2025-09-21 17:52:01,757][root][INFO] - model:
  _target_: models.ffno.FFNO1D
  in_channels: 1
  out_channels: 1
  factor: 4
  n_modes: 64
  width: 128
  n_layers: 4
  ff_weight_norm: true
  n_ff_layers: 3
  layer_norm: true
  dropout: 0.2
  mode: full
  activation: gelu
  use_grid: true
dataset:
  dataset_params:
    _target_: dataloaders.burger_naive_true_multires.burger_true_multires_markov_dataset
    filename_pattern: 1D_Burgers_Sols_Nu*.hdf5
    saved_folder: /data/user_data/rvk/pdebench_gen/
    viscosity: 0.001
    reduced_batch: 1
    reduced_resolution_t: 1
    data_mres_size:
      1024: 800
      0: 0
      256: 0
      128: 1200
    add_res:
    - 32
    - 64
    add_res_samples:
      64: 0
      32: 0
    downsample_from_res: 128
    data_normalizer: true
    normalization_type: simple
    num_samples_max: -1
    eval_dataset_target: dataloaders.burger_naive_markov.burger_markov_dataset
    eval_filename: 1D_Burgers_Sols_Nu0.001.hdf5
    eval_saved_folder: /data/user_data/rvk/pdebench_gen/burgers_1024_0.001/
  resize_to_train: false
  evaluation_type: naive_downsample
  window_size: 15
  rollout_steps: 16
  original_res: 1024
  max_test_resolution: 1024
  train_mres: true
  pde: burger
training:
  batch_size: 16
  epochs: 100
  learning_rate: 0.001
  use_normalizer: false
project_name: ${dataset.pde}_${hydra:runtime.choices.model}
checkpoint_dir: checkpoints

Project name: burger_ffno_1d/ffno_1d
Model name: models.ffno.FFNO1D
PDE Dataset: burger
This is True Multi-Resolution Training. Train Resolution is the highest data resolution in the multi-resolution data
---------------------
Creating true multi-resolution dataset from /data/user_data/rvk/pdebench_gen/
Viscosity: 0.001
Target samples per resolution (from files): {1024: 800, 0: 0, 256: 0, 128: 1200}
Additional downsampled resolutions: [32, 64]
Target samples per downsampled resolution: {64: 0, 32: 0}
Will downsample from resolution: 128
Loading multi-resolution data from /data/user_data/rvk/pdebench_gen/
Viscosity: 0.001
Target samples per resolution (from files): {1024: 800, 0: 0, 256: 0, 128: 1200}
Additional downsampled resolutions: [32, 64]
Target samples per downsampled resolution: {64: 0, 32: 0}
Will downsample from resolution: 128
Loading resolution 1024 from /data/user_data/rvk/pdebench_gen/burgers_1024_0.001/1D_Burgers_Sols_Nu0.001.hdf5
  Original data shape for 1024: (10000, 201, 1024)
  After time reduction: (10000, 201, 1024)
  Split 'train' data shape: (8000, 201, 1024)
  Subsampled to 640 samples for train split
  Added 127360 sample pairs from resolution 1024
Loading resolution 128 from /data/user_data/rvk/pdebench_gen/burgers_128_0.001/1D_Burgers_Sols_Nu0.001.hdf5
  Original data shape for 128: (10000, 201, 128)
  After time reduction: (10000, 201, 128)
  Split 'train' data shape: (8000, 201, 128)
  Subsampled to 960 samples for train split
  Added 191040 sample pairs from resolution 128
Adding downsampled resolutions: [32, 64]
Adding downsampled data from /data/user_data/rvk/pdebench_gen/burgers_128_0.001/1D_Burgers_Sols_Nu0.001.hdf5
  No downsampled samples allocated for train split at resolution 32
  No downsampled samples allocated for train split at resolution 64
Total samples loaded: 318400
Resolution distribution:
  1024_file: 127360 samples
  128_file: 191040 samples
Sample x shapes: [(1, 1024), (1, 1024), (1, 1024)]
Sample y shapes: [(1, 1024), (1, 1024), (1, 1024)]
Loading multi-resolution data from /data/user_data/rvk/pdebench_gen/
Viscosity: 0.001
Target samples per resolution (from files): {1024: 800, 0: 0, 256: 0, 128: 1200}
Additional downsampled resolutions: [32, 64]
Target samples per downsampled resolution: {64: 0, 32: 0}
Will downsample from resolution: 128
Loading resolution 1024 from /data/user_data/rvk/pdebench_gen/burgers_1024_0.001/1D_Burgers_Sols_Nu0.001.hdf5
  Original data shape for 1024: (10000, 201, 1024)
  After time reduction: (10000, 201, 1024)
  Split 'val' data shape: (1000, 201, 1024)
  Subsampled to 80 samples for val split
  Added 15920 sample pairs from resolution 1024
Loading resolution 128 from /data/user_data/rvk/pdebench_gen/burgers_128_0.001/1D_Burgers_Sols_Nu0.001.hdf5
  Original data shape for 128: (10000, 201, 128)
  After time reduction: (10000, 201, 128)
  Split 'val' data shape: (1000, 201, 128)
  Using all 1000 samples for val split
  Added 199000 sample pairs from resolution 128
Adding downsampled resolutions: [32, 64]
Adding downsampled data from /data/user_data/rvk/pdebench_gen/burgers_128_0.001/1D_Burgers_Sols_Nu0.001.hdf5
  No downsampled samples allocated for val split at resolution 32
  No downsampled samples allocated for val split at resolution 64
Total samples loaded: 214920
Resolution distribution:
  1024_file: 15920 samples
  128_file: 199000 samples
Sample x shapes: [(1, 1024), (1, 1024), (1, 1024)]
Sample y shapes: [(1, 1024), (1, 1024), (1, 1024)]
Loading multi-resolution data from /data/user_data/rvk/pdebench_gen/
Viscosity: 0.001
Target samples per resolution (from files): {1024: 800, 0: 0, 256: 0, 128: 1200}
Additional downsampled resolutions: [32, 64]
Target samples per downsampled resolution: {64: 0, 32: 0}
Will downsample from resolution: 128
Loading resolution 1024 from /data/user_data/rvk/pdebench_gen/burgers_1024_0.001/1D_Burgers_Sols_Nu0.001.hdf5
  Original data shape for 1024: (10000, 201, 1024)
  After time reduction: (10000, 201, 1024)
  Split 'test' data shape: (1000, 201, 1024)
  Subsampled to 80 samples for test split
  Added 15920 sample pairs from resolution 1024
Loading resolution 128 from /data/user_data/rvk/pdebench_gen/burgers_128_0.001/1D_Burgers_Sols_Nu0.001.hdf5
  Original data shape for 128: (10000, 201, 128)
  After time reduction: (10000, 201, 128)
  Split 'test' data shape: (1000, 201, 128)
  Using all 1000 samples for test split
  Added 199000 sample pairs from resolution 128
Adding downsampled resolutions: [32, 64]
Adding downsampled data from /data/user_data/rvk/pdebench_gen/burgers_128_0.001/1D_Burgers_Sols_Nu0.001.hdf5
  No downsampled samples allocated for test split at resolution 32
  No downsampled samples allocated for test split at resolution 64
Total samples loaded: 214920
Resolution distribution:
  1024_file: 15920 samples
  128_file: 199000 samples
Sample x shapes: [(1, 1024), (1, 1024), (1, 1024)]
Sample y shapes: [(1, 1024), (1, 1024), (1, 1024)]

==================================================
CREATING ROLLOUT TEST DATASET
==================================================
Extracting Burgers test trajectories for rollout evaluation
Viscosity: 0.001
Loading trajectories from resolution 1024: /data/user_data/rvk/pdebench_gen/burgers_1024_0.001/1D_Burgers_Sols_Nu0.001.hdf5
  Original data shape: (10000, 201, 1024)
  After time reduction: (10000, 201, 1024)
  Test split data shape: (1000, 201, 1024)
  Subsampled to 80 test trajectories
  Extracted 80 complete trajectories from resolution 1024
Loading trajectories from resolution 128: /data/user_data/rvk/pdebench_gen/burgers_128_0.001/1D_Burgers_Sols_Nu0.001.hdf5
  Original data shape: (10000, 201, 128)
  After time reduction: (10000, 201, 128)
  Test split data shape: (1000, 201, 128)
  Using all 1000 test trajectories
  Extracted 1000 complete trajectories from resolution 128

Total extracted trajectories: 1080
Trajectory shapes: [torch.Size([201, 1024]), torch.Size([201, 1024]), torch.Size([201, 1024])]
Resolution distribution:
  Resolution 1024: 80 trajectories
  Resolution 128: 1000 trajectories
Rollout test dataset created with 1080 trajectories
---------Using simple global normalization---------------
Global statistics: X(mean=-0.012724, std=0.633284), Y(mean=-0.012724, std=0.632238)

Final dataset sizes:
Train dataset size: 318400
Validation dataset size: 214920
Test dataset size: 214920
Rollout test dataset size: 1080
<dataloaders.burger_naive_true_multires.burger_true_multires_markov_dataset.<locals>.SimpleNormalizedDataset object at 0x153783283890>
Created resolution groups:
  Resolution 1024: 127360 samples
  Resolution 128: 191040 samples
Created resolution groups:
  Resolution 1024: 15920 samples
  Resolution 128: 199000 samples
Created resolution groups:
  Resolution 1024: 15920 samples
  Resolution 128: 199000 samples
<class 'torch.Tensor'> -0.37637272477149963 -0.3769958019256592 1.0385398864746094 1.0369272232055664
FFNO1D(
  (in_proj): WNLinear(in_features=1, out_features=128, bias=True)
  (fourier_layers): ModuleList(
    (0-3): 4 x FSpectralConv1d(
      (fourier_weight): ParameterList(  (0): Parameter containing: [torch.float32 of size 128x128x64x2 (cuda:0)])
      (backcast_ff): FeedForward(
        (layers): ModuleList(
          (0): Sequential(
            (0): Linear(in_features=128, out_features=512, bias=True)
            (1): Dropout(p=0.2, inplace=False)
            (2): GELU(approximate='none')
            (3): Identity()
          )
          (1): Sequential(
            (0): Linear(in_features=512, out_features=512, bias=True)
            (1): Dropout(p=0.2, inplace=False)
            (2): GELU(approximate='none')
            (3): Identity()
          )
          (2): Sequential(
            (0): Linear(in_features=512, out_features=128, bias=True)
            (1): Dropout(p=0.2, inplace=False)
            (2): Identity()
            (3): LayerNorm((128,), eps=1e-05, elementwise_affine=True)
          )
        )
      )
    )
  )
  (out_proj): WNLinear(in_features=128, out_features=1, bias=True)
)
Total Model Parameters: 9.97M
Trainable Parameters: 9.97M
Epoch 0, Train Loss: 0.01908203, Val Loss: 0.00481910
Epoch 10, Train Loss: 0.00264972, Val Loss: 0.00190251
Epoch 20, Train Loss: 0.00226806, Val Loss: 0.00236900
Epoch 30, Train Loss: 0.00196313, Val Loss: 0.00202436
Epoch 40, Train Loss: 0.00175452, Val Loss: 0.00178858
Epoch 50, Train Loss: 0.00157681, Val Loss: 0.00175356
Epoch 60, Train Loss: 0.00142687, Val Loss: 0.00126184
Epoch 70, Train Loss: 0.00129820, Val Loss: 0.00123948
Epoch 80, Train Loss: 0.00121074, Val Loss: 0.00130452
Epoch 90, Train Loss: 0.00116397, Val Loss: 0.00119684
Test L2 Loss: 0.001178
Model saved to checkpoints/ffno1d/burger_5562044.pt
Created/verified figures directory: figures/5562044
Evaluating BURGER model at multiple resolutions
Using normalizer from training resolution 1024
Testing resolutions: [32, 64, 128, 256, 512, 1024]
Loading from file: /data/user_data/rvk/pdebench_gen/burgers_1024_0.001/1D_Burgers_Sols_Nu0.001.hdf5
(10000, 201, 1024)
After downsampling data shape: (10000, 201, 32)
Total data shape: (10000, 201, 32)
x shape: (1990000, 1, 32)
y shape: (1990000, 1, 32)
grid shape: torch.Size([32, 1])

==================================================
CREATING ROLLOUT TEST DATASET
==================================================
Extracting Burgers test trajectories for rollout evaluation
File: 1D_Burgers_Sols_Nu0.001.hdf5
Loading from file: /data/user_data/rvk/pdebench_gen/burgers_1024_0.001/1D_Burgers_Sols_Nu0.001.hdf5
Original data shape: (10000, 201, 1024)
After downsampling data shape: (10000, 201, 32)
Total data shape after sampling: (10000, 201, 32)
Test split data shape: (1000, 201, 32)
Extracted 1000 complete trajectories
Trajectory shapes: [torch.Size([201, 32]), torch.Size([201, 32]), torch.Size([201, 32])]
Rollout test dataset created with 1000 trajectories

Final dataset sizes:
Train dataset size: 1592000
Validation dataset size: 199000
Test dataset size: 199000
Rollout test dataset size: 1000
Selected random indices for plotting: [44098, 179372, 155987, 162898, 143656, 21241, 52596, 112013, 21258, 104724]
Collected 10 examples for resolution 32
Resolution 32 (downsample factor: 32) - Relative L2 Loss: 0.049829
Memory cleaned after resolution 32


Loading from file: /data/user_data/rvk/pdebench_gen/burgers_1024_0.001/1D_Burgers_Sols_Nu0.001.hdf5
(10000, 201, 1024)
After downsampling data shape: (10000, 201, 64)
Total data shape: (10000, 201, 64)
x shape: (1990000, 1, 64)
y shape: (1990000, 1, 64)
grid shape: torch.Size([64, 1])

==================================================
CREATING ROLLOUT TEST DATASET
==================================================
Extracting Burgers test trajectories for rollout evaluation
File: 1D_Burgers_Sols_Nu0.001.hdf5
Loading from file: /data/user_data/rvk/pdebench_gen/burgers_1024_0.001/1D_Burgers_Sols_Nu0.001.hdf5
Original data shape: (10000, 201, 1024)
After downsampling data shape: (10000, 201, 64)
Total data shape after sampling: (10000, 201, 64)
Test split data shape: (1000, 201, 64)
Extracted 1000 complete trajectories
Trajectory shapes: [torch.Size([201, 64]), torch.Size([201, 64]), torch.Size([201, 64])]
Rollout test dataset created with 1000 trajectories

Final dataset sizes:
Train dataset size: 1592000
Validation dataset size: 199000
Test dataset size: 199000
Rollout test dataset size: 1000
Collected 10 examples for resolution 64
Resolution 64 (downsample factor: 16) - Relative L2 Loss: 0.031654
Memory cleaned after resolution 64


Loading from file: /data/user_data/rvk/pdebench_gen/burgers_1024_0.001/1D_Burgers_Sols_Nu0.001.hdf5
(10000, 201, 1024)
After downsampling data shape: (10000, 201, 128)
Total data shape: (10000, 201, 128)
x shape: (1990000, 1, 128)
y shape: (1990000, 1, 128)
grid shape: torch.Size([128, 1])

==================================================
CREATING ROLLOUT TEST DATASET
==================================================
Extracting Burgers test trajectories for rollout evaluation
File: 1D_Burgers_Sols_Nu0.001.hdf5
Loading from file: /data/user_data/rvk/pdebench_gen/burgers_1024_0.001/1D_Burgers_Sols_Nu0.001.hdf5
Original data shape: (10000, 201, 1024)
After downsampling data shape: (10000, 201, 128)
Total data shape after sampling: (10000, 201, 128)
Test split data shape: (1000, 201, 128)
Extracted 1000 complete trajectories
Trajectory shapes: [torch.Size([201, 128]), torch.Size([201, 128]), torch.Size([201, 128])]
Rollout test dataset created with 1000 trajectories

Final dataset sizes:
Train dataset size: 1592000
Validation dataset size: 199000
Test dataset size: 199000
Rollout test dataset size: 1000
Collected 10 examples for resolution 128
Resolution 128 (downsample factor: 8) - Relative L2 Loss: 0.015335
Memory cleaned after resolution 128


Loading from file: /data/user_data/rvk/pdebench_gen/burgers_1024_0.001/1D_Burgers_Sols_Nu0.001.hdf5
(10000, 201, 1024)
After downsampling data shape: (10000, 201, 256)
Total data shape: (10000, 201, 256)
x shape: (1990000, 1, 256)
y shape: (1990000, 1, 256)
grid shape: torch.Size([256, 1])

==================================================
CREATING ROLLOUT TEST DATASET
==================================================
Extracting Burgers test trajectories for rollout evaluation
File: 1D_Burgers_Sols_Nu0.001.hdf5
Loading from file: /data/user_data/rvk/pdebench_gen/burgers_1024_0.001/1D_Burgers_Sols_Nu0.001.hdf5
Original data shape: (10000, 201, 1024)
After downsampling data shape: (10000, 201, 256)
Total data shape after sampling: (10000, 201, 256)
Test split data shape: (1000, 201, 256)
Extracted 1000 complete trajectories
Trajectory shapes: [torch.Size([201, 256]), torch.Size([201, 256]), torch.Size([201, 256])]
Rollout test dataset created with 1000 trajectories

Final dataset sizes:
Train dataset size: 1592000
Validation dataset size: 199000
Test dataset size: 199000
Rollout test dataset size: 1000
Collected 10 examples for resolution 256
Resolution 256 (downsample factor: 4) - Relative L2 Loss: 0.003889
Memory cleaned after resolution 256


Loading from file: /data/user_data/rvk/pdebench_gen/burgers_1024_0.001/1D_Burgers_Sols_Nu0.001.hdf5
(10000, 201, 1024)
After downsampling data shape: (10000, 201, 512)
Total data shape: (10000, 201, 512)
x shape: (1990000, 1, 512)
y shape: (1990000, 1, 512)
grid shape: torch.Size([512, 1])

==================================================
CREATING ROLLOUT TEST DATASET
==================================================
Extracting Burgers test trajectories for rollout evaluation
File: 1D_Burgers_Sols_Nu0.001.hdf5
Loading from file: /data/user_data/rvk/pdebench_gen/burgers_1024_0.001/1D_Burgers_Sols_Nu0.001.hdf5
Original data shape: (10000, 201, 1024)
After downsampling data shape: (10000, 201, 512)
Total data shape after sampling: (10000, 201, 512)
Test split data shape: (1000, 201, 512)
Extracted 1000 complete trajectories
Trajectory shapes: [torch.Size([201, 512]), torch.Size([201, 512]), torch.Size([201, 512])]
Rollout test dataset created with 1000 trajectories

Final dataset sizes:
Train dataset size: 1592000
Validation dataset size: 199000
Test dataset size: 199000
Rollout test dataset size: 1000
Collected 10 examples for resolution 512
Resolution 512 (downsample factor: 2) - Relative L2 Loss: 0.002154
Memory cleaned after resolution 512


Loading from file: /data/user_data/rvk/pdebench_gen/burgers_1024_0.001/1D_Burgers_Sols_Nu0.001.hdf5
(10000, 201, 1024)
After downsampling data shape: (10000, 201, 1024)
Total data shape: (10000, 201, 1024)
x shape: (1990000, 1, 1024)
y shape: (1990000, 1, 1024)
grid shape: torch.Size([1024, 1])

==================================================
CREATING ROLLOUT TEST DATASET
==================================================
Extracting Burgers test trajectories for rollout evaluation
File: 1D_Burgers_Sols_Nu0.001.hdf5
Loading from file: /data/user_data/rvk/pdebench_gen/burgers_1024_0.001/1D_Burgers_Sols_Nu0.001.hdf5
Original data shape: (10000, 201, 1024)
After downsampling data shape: (10000, 201, 1024)
Total data shape after sampling: (10000, 201, 1024)
Test split data shape: (1000, 201, 1024)
Extracted 1000 complete trajectories
Trajectory shapes: [torch.Size([201, 1024]), torch.Size([201, 1024]), torch.Size([201, 1024])]
Rollout test dataset created with 1000 trajectories

Final dataset sizes:
Train dataset size: 1592000
Validation dataset size: 199000
Test dataset size: 199000
Rollout test dataset size: 1000
Collected 10 examples for resolution 1024
Resolution 1024 (downsample factor: 1) - Relative L2 Loss: 0.002019
Memory cleaned after resolution 1024


Creating prediction vs target plots...
Saved prediction plot: figures/5562044/prediction_plots/burger_predictions_vs_targets_10_examples.png
Saved numerical results: figures/5562044/burger_1d_evaluation_results_20250922_015458.csv
Saved summary: figures/5562044/burger_1d_evaluation_summary_20250922_015458.txt

==================================================
BURGER EVALUATION SUMMARY
==================================================
Resolution  32: 0.049829
Resolution  64: 0.031654
Resolution 128: 0.015335
Resolution 256: 0.003889
Resolution 512: 0.002154
Resolution 1024: 0.002019
Evaluating BURGER model rollout at multiple resolutions
Using normalizer from training resolution 1024
Rollout steps: 16
Testing resolutions: [32, 64, 128, 256, 512, 1024]

--- Evaluating Rollout at Resolution 32 (downsample factor: 32) ---
Loading dataset with config: dataloaders.burger_naive_markov.burger_markov_dataset
Loading from file: /data/user_data/rvk/pdebench_gen/burgers_1024_0.001/1D_Burgers_Sols_Nu0.001.hdf5
(10000, 201, 1024)
After downsampling data shape: (10000, 201, 32)
Total data shape: (10000, 201, 32)
x shape: (1990000, 1, 32)
y shape: (1990000, 1, 32)
grid shape: torch.Size([32, 1])

==================================================
CREATING ROLLOUT TEST DATASET
==================================================
Extracting Burgers test trajectories for rollout evaluation
File: 1D_Burgers_Sols_Nu0.001.hdf5
Loading from file: /data/user_data/rvk/pdebench_gen/burgers_1024_0.001/1D_Burgers_Sols_Nu0.001.hdf5
Original data shape: (10000, 201, 1024)
After downsampling data shape: (10000, 201, 32)
Total data shape after sampling: (10000, 201, 32)
Test split data shape: (1000, 201, 32)
Extracted 1000 complete trajectories
Trajectory shapes: [torch.Size([201, 32]), torch.Size([201, 32]), torch.Size([201, 32])]
Rollout test dataset created with 1000 trajectories

Final dataset sizes:
Train dataset size: 1592000
Validation dataset size: 199000
Test dataset size: 199000
Rollout test dataset size: 1000
Using rollout test dataset with 1000 trajectories
Selected random indices for plotting: [15, 13, 31, 27, 10]
Collected 5 rollout examples for resolution 32
Resolution 32 (downsample factor: 32) - Rollout Loss (16 steps): 0.357492
Memory cleaned after resolution 32

--- Evaluating Rollout at Resolution 64 (downsample factor: 16) ---
Loading dataset with config: dataloaders.burger_naive_markov.burger_markov_dataset
Loading from file: /data/user_data/rvk/pdebench_gen/burgers_1024_0.001/1D_Burgers_Sols_Nu0.001.hdf5
(10000, 201, 1024)
After downsampling data shape: (10000, 201, 64)
Total data shape: (10000, 201, 64)
x shape: (1990000, 1, 64)
y shape: (1990000, 1, 64)
grid shape: torch.Size([64, 1])

==================================================
CREATING ROLLOUT TEST DATASET
==================================================
Extracting Burgers test trajectories for rollout evaluation
File: 1D_Burgers_Sols_Nu0.001.hdf5
Loading from file: /data/user_data/rvk/pdebench_gen/burgers_1024_0.001/1D_Burgers_Sols_Nu0.001.hdf5
Original data shape: (10000, 201, 1024)
After downsampling data shape: (10000, 201, 64)
Total data shape after sampling: (10000, 201, 64)
Test split data shape: (1000, 201, 64)
Extracted 1000 complete trajectories
Trajectory shapes: [torch.Size([201, 64]), torch.Size([201, 64]), torch.Size([201, 64])]
Rollout test dataset created with 1000 trajectories

Final dataset sizes:
Train dataset size: 1592000
Validation dataset size: 199000
Test dataset size: 199000
Rollout test dataset size: 1000
Using rollout test dataset with 1000 trajectories
Collected 5 rollout examples for resolution 64
Resolution 64 (downsample factor: 16) - Rollout Loss (16 steps): 0.091393
Memory cleaned after resolution 64

--- Evaluating Rollout at Resolution 128 (downsample factor: 8) ---
Loading dataset with config: dataloaders.burger_naive_markov.burger_markov_dataset
Loading from file: /data/user_data/rvk/pdebench_gen/burgers_1024_0.001/1D_Burgers_Sols_Nu0.001.hdf5
(10000, 201, 1024)
After downsampling data shape: (10000, 201, 128)
Total data shape: (10000, 201, 128)
x shape: (1990000, 1, 128)
y shape: (1990000, 1, 128)
grid shape: torch.Size([128, 1])

==================================================
CREATING ROLLOUT TEST DATASET
==================================================
Extracting Burgers test trajectories for rollout evaluation
File: 1D_Burgers_Sols_Nu0.001.hdf5
Loading from file: /data/user_data/rvk/pdebench_gen/burgers_1024_0.001/1D_Burgers_Sols_Nu0.001.hdf5
Original data shape: (10000, 201, 1024)
After downsampling data shape: (10000, 201, 128)
Total data shape after sampling: (10000, 201, 128)
Test split data shape: (1000, 201, 128)
Extracted 1000 complete trajectories
Trajectory shapes: [torch.Size([201, 128]), torch.Size([201, 128]), torch.Size([201, 128])]
Rollout test dataset created with 1000 trajectories

Final dataset sizes:
Train dataset size: 1592000
Validation dataset size: 199000
Test dataset size: 199000
Rollout test dataset size: 1000
Using rollout test dataset with 1000 trajectories
Collected 5 rollout examples for resolution 128
Resolution 128 (downsample factor: 8) - Rollout Loss (16 steps): 0.050284
Memory cleaned after resolution 128

--- Evaluating Rollout at Resolution 256 (downsample factor: 4) ---
Loading dataset with config: dataloaders.burger_naive_markov.burger_markov_dataset
Loading from file: /data/user_data/rvk/pdebench_gen/burgers_1024_0.001/1D_Burgers_Sols_Nu0.001.hdf5
(10000, 201, 1024)
After downsampling data shape: (10000, 201, 256)
Total data shape: (10000, 201, 256)
x shape: (1990000, 1, 256)
y shape: (1990000, 1, 256)
grid shape: torch.Size([256, 1])

==================================================
CREATING ROLLOUT TEST DATASET
==================================================
Extracting Burgers test trajectories for rollout evaluation
File: 1D_Burgers_Sols_Nu0.001.hdf5
Loading from file: /data/user_data/rvk/pdebench_gen/burgers_1024_0.001/1D_Burgers_Sols_Nu0.001.hdf5
Original data shape: (10000, 201, 1024)
After downsampling data shape: (10000, 201, 256)
Total data shape after sampling: (10000, 201, 256)
Test split data shape: (1000, 201, 256)
Extracted 1000 complete trajectories
Trajectory shapes: [torch.Size([201, 256]), torch.Size([201, 256]), torch.Size([201, 256])]
Rollout test dataset created with 1000 trajectories

Final dataset sizes:
Train dataset size: 1592000
Validation dataset size: 199000
Test dataset size: 199000
Rollout test dataset size: 1000
Using rollout test dataset with 1000 trajectories
Collected 5 rollout examples for resolution 256
Resolution 256 (downsample factor: 4) - Rollout Loss (16 steps): 0.042850
Memory cleaned after resolution 256

--- Evaluating Rollout at Resolution 512 (downsample factor: 2) ---
Loading dataset with config: dataloaders.burger_naive_markov.burger_markov_dataset
Loading from file: /data/user_data/rvk/pdebench_gen/burgers_1024_0.001/1D_Burgers_Sols_Nu0.001.hdf5
(10000, 201, 1024)
After downsampling data shape: (10000, 201, 512)
Total data shape: (10000, 201, 512)
x shape: (1990000, 1, 512)
y shape: (1990000, 1, 512)
grid shape: torch.Size([512, 1])

==================================================
CREATING ROLLOUT TEST DATASET
==================================================
Extracting Burgers test trajectories for rollout evaluation
File: 1D_Burgers_Sols_Nu0.001.hdf5
Loading from file: /data/user_data/rvk/pdebench_gen/burgers_1024_0.001/1D_Burgers_Sols_Nu0.001.hdf5
Original data shape: (10000, 201, 1024)
After downsampling data shape: (10000, 201, 512)
Total data shape after sampling: (10000, 201, 512)
Test split data shape: (1000, 201, 512)
Extracted 1000 complete trajectories
Trajectory shapes: [torch.Size([201, 512]), torch.Size([201, 512]), torch.Size([201, 512])]
Rollout test dataset created with 1000 trajectories

Final dataset sizes:
Train dataset size: 1592000
Validation dataset size: 199000
Test dataset size: 199000
Rollout test dataset size: 1000
Using rollout test dataset with 1000 trajectories
Collected 5 rollout examples for resolution 512
Resolution 512 (downsample factor: 2) - Rollout Loss (16 steps): 0.036868
Memory cleaned after resolution 512

--- Evaluating Rollout at Resolution 1024 (downsample factor: 1) ---
Loading dataset with config: dataloaders.burger_naive_markov.burger_markov_dataset
Loading from file: /data/user_data/rvk/pdebench_gen/burgers_1024_0.001/1D_Burgers_Sols_Nu0.001.hdf5
(10000, 201, 1024)
After downsampling data shape: (10000, 201, 1024)
Total data shape: (10000, 201, 1024)
x shape: (1990000, 1, 1024)
y shape: (1990000, 1, 1024)
grid shape: torch.Size([1024, 1])

==================================================
CREATING ROLLOUT TEST DATASET
==================================================
Extracting Burgers test trajectories for rollout evaluation
File: 1D_Burgers_Sols_Nu0.001.hdf5
Loading from file: /data/user_data/rvk/pdebench_gen/burgers_1024_0.001/1D_Burgers_Sols_Nu0.001.hdf5
Original data shape: (10000, 201, 1024)
After downsampling data shape: (10000, 201, 1024)
Total data shape after sampling: (10000, 201, 1024)
Test split data shape: (1000, 201, 1024)
Extracted 1000 complete trajectories
Trajectory shapes: [torch.Size([201, 1024]), torch.Size([201, 1024]), torch.Size([201, 1024])]
Rollout test dataset created with 1000 trajectories

Final dataset sizes:
Train dataset size: 1592000
Validation dataset size: 199000
Test dataset size: 199000
Rollout test dataset size: 1000
Using rollout test dataset with 1000 trajectories
Collected 5 rollout examples for resolution 1024
Resolution 1024 (downsample factor: 1) - Rollout Loss (16 steps): 0.036665
Memory cleaned after resolution 1024
Creating rollout prediction plots...
Rollout plots saved to: figures/5562044/rollout_plots/burger_rollout_examples.png
Rollout results saved to: figures/5562044/burger_rollout_results_trained_res_1024_steps_16.csv

============================================================
BURGER ROLLOUT EVALUATION SUMMARY (16 steps)
============================================================
Resolution  32: 0.357492
Resolution  64: 0.091393
Resolution 128: 0.050284
Resolution 256: 0.042850
Resolution 512: 0.036868
Resolution 1024: 0.036665

Summary of Super-Resolution Evaluation:
Resolution factor 32: Relative L2 Loss = 0.049829
Resolution factor 64: Relative L2 Loss = 0.031654
Resolution factor 128: Relative L2 Loss = 0.015335
Resolution factor 256: Relative L2 Loss = 0.003889
Resolution factor 512: Relative L2 Loss = 0.002154
Resolution factor 1024: Relative L2 Loss = 0.002019

Evaluation plots saved to: figures/5562044
Wandb run: https://wandb.ai/rohanvk-carnegie-mellon-university/ffno1d/runs/7cs5ord4
Using device: cuda
[2025-09-22 01:56:01,981][root][INFO] - model:
  _target_: models.ffno.FFNO1D
  in_channels: 1
  out_channels: 1
  factor: 4
  n_modes: 64
  width: 128
  n_layers: 4
  ff_weight_norm: true
  n_ff_layers: 3
  layer_norm: true
  dropout: 0.2
  mode: full
  activation: gelu
  use_grid: true
dataset:
  dataset_params:
    _target_: dataloaders.burger_naive_true_multires.burger_true_multires_markov_dataset
    filename_pattern: 1D_Burgers_Sols_Nu*.hdf5
    saved_folder: /data/user_data/rvk/pdebench_gen/
    viscosity: 0.0001
    reduced_batch: 1
    reduced_resolution_t: 1
    data_mres_size:
      1024: 0
      512: 0
      256: 0
      128: 0
    add_res:
    - 32
    - 64
    add_res_samples:
      64: 0
      32: 2000
    downsample_from_res: 128
    data_normalizer: true
    normalization_type: simple
    num_samples_max: -1
    eval_dataset_target: dataloaders.burger_naive_markov.burger_markov_dataset
    eval_filename: 1D_Burgers_Sols_Nu0.0001.hdf5
    eval_saved_folder: /data/user_data/rvk/pdebench_gen/burgers_1024_0.0001/
  resize_to_train: false
  evaluation_type: naive_downsample
  window_size: 15
  original_res: 1024
  max_test_resolution: 1024
  train_mres: true
  pde: burger
training:
  batch_size: 16
  epochs: 100
  learning_rate: 0.001
  use_normalizer: false
project_name: ${dataset.pde}_${hydra:runtime.choices.model}
checkpoint_dir: checkpoints

Project name: burger_ffno_1d/ffno_1d
Model name: models.ffno.FFNO1D
PDE Dataset: burger
This is True Multi-Resolution Training. Train Resolution is the highest data resolution in the multi-resolution data
---------------------
Creating true multi-resolution dataset from /data/user_data/rvk/pdebench_gen/
Viscosity: 0.0001
Target samples per resolution (from files): {1024: 0, 512: 0, 256: 0, 128: 0}
Additional downsampled resolutions: [32, 64]
Target samples per downsampled resolution: {64: 0, 32: 2000}
Will downsample from resolution: 128
Loading multi-resolution data from /data/user_data/rvk/pdebench_gen/
Viscosity: 0.0001
Target samples per resolution (from files): {1024: 0, 512: 0, 256: 0, 128: 0}
Additional downsampled resolutions: [32, 64]
Target samples per downsampled resolution: {64: 0, 32: 2000}
Will downsample from resolution: 128
Adding downsampled resolutions: [32, 64]
Adding downsampled data from /data/user_data/rvk/pdebench_gen/burgers_128_0.0001/1D_Burgers_Sols_Nu0.0001.hdf5
  Added 318400 downsampled samples at resolution 32
  No downsampled samples allocated for train split at resolution 64
Total samples loaded: 318400
Resolution distribution:
  32_downsampled: 318400 samples
Sample x shapes: [(1, 32), (1, 32), (1, 32)]
Sample y shapes: [(1, 32), (1, 32), (1, 32)]
Loading multi-resolution data from /data/user_data/rvk/pdebench_gen/
Viscosity: 0.0001
Target samples per resolution (from files): {1024: 0, 512: 0, 256: 0, 128: 0}
Additional downsampled resolutions: [32, 64]
Target samples per downsampled resolution: {64: 0, 32: 2000}
Will downsample from resolution: 128
Adding downsampled resolutions: [32, 64]
Adding downsampled data from /data/user_data/rvk/pdebench_gen/burgers_128_0.0001/1D_Burgers_Sols_Nu0.0001.hdf5
  Added 39800 downsampled samples at resolution 32
  No downsampled samples allocated for val split at resolution 64
Total samples loaded: 39800
Resolution distribution:
  32_downsampled: 39800 samples
Sample x shapes: [(1, 32), (1, 32), (1, 32)]
Sample y shapes: [(1, 32), (1, 32), (1, 32)]
Loading multi-resolution data from /data/user_data/rvk/pdebench_gen/
Viscosity: 0.0001
Target samples per resolution (from files): {1024: 0, 512: 0, 256: 0, 128: 0}
Additional downsampled resolutions: [32, 64]
Target samples per downsampled resolution: {64: 0, 32: 2000}
Will downsample from resolution: 128
Adding downsampled resolutions: [32, 64]
Adding downsampled data from /data/user_data/rvk/pdebench_gen/burgers_128_0.0001/1D_Burgers_Sols_Nu0.0001.hdf5
  Added 39800 downsampled samples at resolution 32
  No downsampled samples allocated for test split at resolution 64
Total samples loaded: 39800
Resolution distribution:
  32_downsampled: 39800 samples
Sample x shapes: [(1, 32), (1, 32), (1, 32)]
Sample y shapes: [(1, 32), (1, 32), (1, 32)]

==================================================
CREATING ROLLOUT TEST DATASET
==================================================
Extracting Burgers test trajectories for rollout evaluation
Viscosity: 0.0001

Total extracted trajectories: 0
Rollout test dataset created with 0 trajectories
---------Using simple global normalization---------------
Global statistics: X(mean=-0.001227, std=0.653480), Y(mean=-0.001227, std=0.652458)

Final dataset sizes:
Train dataset size: 318400
Validation dataset size: 39800
Test dataset size: 39800
Rollout test dataset size: 0
<dataloaders.burger_naive_true_multires.burger_true_multires_markov_dataset.<locals>.SimpleNormalizedDataset object at 0x149fafa7a0d0>
Created resolution groups:
  Resolution 32: 318400 samples
Created resolution groups:
  Resolution 32: 39800 samples
Created resolution groups:
  Resolution 32: 39800 samples
<class 'torch.Tensor'> 0.5823805332183838 0.5858743786811829 0.9083060026168823 0.9064139127731323
FFNO1D(
  (in_proj): WNLinear(in_features=1, out_features=128, bias=True)
  (fourier_layers): ModuleList(
    (0-3): 4 x FSpectralConv1d(
      (fourier_weight): ParameterList(  (0): Parameter containing: [torch.float32 of size 128x128x64x2 (cuda:0)])
      (backcast_ff): FeedForward(
        (layers): ModuleList(
          (0): Sequential(
            (0): Linear(in_features=128, out_features=512, bias=True)
            (1): Dropout(p=0.2, inplace=False)
            (2): GELU(approximate='none')
            (3): Identity()
          )
          (1): Sequential(
            (0): Linear(in_features=512, out_features=512, bias=True)
            (1): Dropout(p=0.2, inplace=False)
            (2): GELU(approximate='none')
            (3): Identity()
          )
          (2): Sequential(
            (0): Linear(in_features=512, out_features=128, bias=True)
            (1): Dropout(p=0.2, inplace=False)
            (2): Identity()
            (3): LayerNorm((128,), eps=1e-05, elementwise_affine=True)
          )
        )
      )
    )
  )
  (out_proj): WNLinear(in_features=128, out_features=1, bias=True)
)
Total Model Parameters: 9.97M
Trainable Parameters: 9.97M
Epoch 0, Train Loss: 0.02831657, Val Loss: 0.01237370
Epoch 10, Train Loss: 0.00747186, Val Loss: 0.00680448
Epoch 20, Train Loss: 0.00639953, Val Loss: 0.00577286
Epoch 30, Train Loss: 0.00577074, Val Loss: 0.00533869
Epoch 40, Train Loss: 0.00525089, Val Loss: 0.00527673
Epoch 50, Train Loss: 0.00479339, Val Loss: 0.00553862
Epoch 60, Train Loss: 0.00434821, Val Loss: 0.00425438
Epoch 70, Train Loss: 0.00396837, Val Loss: 0.00425285
Epoch 80, Train Loss: 0.00365985, Val Loss: 0.00402761
Epoch 90, Train Loss: 0.00348517, Val Loss: 0.00391438
Test L2 Loss: 0.003864
Model saved to checkpoints/ffno1d/burger_5562044.pt
Created/verified figures directory: figures/5562044
Evaluating BURGER model at multiple resolutions
Using normalizer from training resolution 1024
Testing resolutions: [32, 64, 128, 256, 512, 1024]
Loading from file: /data/user_data/rvk/pdebench_gen/burgers_1024_0.0001/1D_Burgers_Sols_Nu0.0001.hdf5
(10000, 201, 1024)
After downsampling data shape: (10000, 201, 32)
Total data shape: (10000, 201, 32)
x shape: (1990000, 1, 32)
y shape: (1990000, 1, 32)
grid shape: torch.Size([32, 1])

==================================================
CREATING ROLLOUT TEST DATASET
==================================================
Extracting Burgers test trajectories for rollout evaluation
File: 1D_Burgers_Sols_Nu0.0001.hdf5
Loading from file: /data/user_data/rvk/pdebench_gen/burgers_1024_0.0001/1D_Burgers_Sols_Nu0.0001.hdf5
Original data shape: (10000, 201, 1024)
After downsampling data shape: (10000, 201, 32)
Total data shape after sampling: (10000, 201, 32)
Test split data shape: (1000, 201, 32)
Extracted 1000 complete trajectories
Trajectory shapes: [torch.Size([201, 32]), torch.Size([201, 32]), torch.Size([201, 32])]
Rollout test dataset created with 1000 trajectories

Final dataset sizes:
Train dataset size: 1592000
Validation dataset size: 199000
Test dataset size: 199000
Rollout test dataset size: 1000
Selected random indices for plotting: [27171, 116465, 155492, 97478, 160373, 106387, 11071, 13573, 151378, 1632]
Collected 10 examples for resolution 32
Resolution 32 (downsample factor: 32) - Relative L2 Loss: 0.038825
Memory cleaned after resolution 32


Loading from file: /data/user_data/rvk/pdebench_gen/burgers_1024_0.0001/1D_Burgers_Sols_Nu0.0001.hdf5
(10000, 201, 1024)
After downsampling data shape: (10000, 201, 64)
Total data shape: (10000, 201, 64)
x shape: (1990000, 1, 64)
y shape: (1990000, 1, 64)
grid shape: torch.Size([64, 1])

==================================================
CREATING ROLLOUT TEST DATASET
==================================================
Extracting Burgers test trajectories for rollout evaluation
File: 1D_Burgers_Sols_Nu0.0001.hdf5
Loading from file: /data/user_data/rvk/pdebench_gen/burgers_1024_0.0001/1D_Burgers_Sols_Nu0.0001.hdf5
Original data shape: (10000, 201, 1024)
After downsampling data shape: (10000, 201, 64)
Total data shape after sampling: (10000, 201, 64)
Test split data shape: (1000, 201, 64)
Extracted 1000 complete trajectories
Trajectory shapes: [torch.Size([201, 64]), torch.Size([201, 64]), torch.Size([201, 64])]
Rollout test dataset created with 1000 trajectories

Final dataset sizes:
Train dataset size: 1592000
Validation dataset size: 199000
Test dataset size: 199000
Rollout test dataset size: 1000
Collected 10 examples for resolution 64
Resolution 64 (downsample factor: 16) - Relative L2 Loss: 0.072115
Memory cleaned after resolution 64


Loading from file: /data/user_data/rvk/pdebench_gen/burgers_1024_0.0001/1D_Burgers_Sols_Nu0.0001.hdf5
(10000, 201, 1024)
After downsampling data shape: (10000, 201, 128)
Total data shape: (10000, 201, 128)
x shape: (1990000, 1, 128)
y shape: (1990000, 1, 128)
grid shape: torch.Size([128, 1])

==================================================
CREATING ROLLOUT TEST DATASET
==================================================
Extracting Burgers test trajectories for rollout evaluation
File: 1D_Burgers_Sols_Nu0.0001.hdf5
Loading from file: /data/user_data/rvk/pdebench_gen/burgers_1024_0.0001/1D_Burgers_Sols_Nu0.0001.hdf5
Original data shape: (10000, 201, 1024)
After downsampling data shape: (10000, 201, 128)
Total data shape after sampling: (10000, 201, 128)
Test split data shape: (1000, 201, 128)
Extracted 1000 complete trajectories
Trajectory shapes: [torch.Size([201, 128]), torch.Size([201, 128]), torch.Size([201, 128])]
Rollout test dataset created with 1000 trajectories

Final dataset sizes:
Train dataset size: 1592000
Validation dataset size: 199000
Test dataset size: 199000
Rollout test dataset size: 1000
Collected 10 examples for resolution 128
Resolution 128 (downsample factor: 8) - Relative L2 Loss: 0.074853
Memory cleaned after resolution 128


Loading from file: /data/user_data/rvk/pdebench_gen/burgers_1024_0.0001/1D_Burgers_Sols_Nu0.0001.hdf5
(10000, 201, 1024)
After downsampling data shape: (10000, 201, 256)
Total data shape: (10000, 201, 256)
x shape: (1990000, 1, 256)
y shape: (1990000, 1, 256)
grid shape: torch.Size([256, 1])

==================================================
CREATING ROLLOUT TEST DATASET
==================================================
Extracting Burgers test trajectories for rollout evaluation
File: 1D_Burgers_Sols_Nu0.0001.hdf5
Loading from file: /data/user_data/rvk/pdebench_gen/burgers_1024_0.0001/1D_Burgers_Sols_Nu0.0001.hdf5
Original data shape: (10000, 201, 1024)
After downsampling data shape: (10000, 201, 256)
Total data shape after sampling: (10000, 201, 256)
Test split data shape: (1000, 201, 256)
Extracted 1000 complete trajectories
Trajectory shapes: [torch.Size([201, 256]), torch.Size([201, 256]), torch.Size([201, 256])]
Rollout test dataset created with 1000 trajectories

Final dataset sizes:
Train dataset size: 1592000
Validation dataset size: 199000
Test dataset size: 199000
Rollout test dataset size: 1000
Collected 10 examples for resolution 256
Resolution 256 (downsample factor: 4) - Relative L2 Loss: 0.076863
Memory cleaned after resolution 256


Loading from file: /data/user_data/rvk/pdebench_gen/burgers_1024_0.0001/1D_Burgers_Sols_Nu0.0001.hdf5
(10000, 201, 1024)
After downsampling data shape: (10000, 201, 512)
Total data shape: (10000, 201, 512)
x shape: (1990000, 1, 512)
y shape: (1990000, 1, 512)
grid shape: torch.Size([512, 1])

==================================================
CREATING ROLLOUT TEST DATASET
==================================================
Extracting Burgers test trajectories for rollout evaluation
File: 1D_Burgers_Sols_Nu0.0001.hdf5
Loading from file: /data/user_data/rvk/pdebench_gen/burgers_1024_0.0001/1D_Burgers_Sols_Nu0.0001.hdf5
Original data shape: (10000, 201, 1024)
After downsampling data shape: (10000, 201, 512)
Total data shape after sampling: (10000, 201, 512)
Test split data shape: (1000, 201, 512)
Extracted 1000 complete trajectories
Trajectory shapes: [torch.Size([201, 512]), torch.Size([201, 512]), torch.Size([201, 512])]
Rollout test dataset created with 1000 trajectories

Final dataset sizes:
Train dataset size: 1592000
Validation dataset size: 199000
Test dataset size: 199000
Rollout test dataset size: 1000
Collected 10 examples for resolution 512
Resolution 512 (downsample factor: 2) - Relative L2 Loss: 0.077526
Memory cleaned after resolution 512


Loading from file: /data/user_data/rvk/pdebench_gen/burgers_1024_0.0001/1D_Burgers_Sols_Nu0.0001.hdf5
(10000, 201, 1024)
After downsampling data shape: (10000, 201, 1024)
Total data shape: (10000, 201, 1024)
x shape: (1990000, 1, 1024)
y shape: (1990000, 1, 1024)
grid shape: torch.Size([1024, 1])

==================================================
CREATING ROLLOUT TEST DATASET
==================================================
Extracting Burgers test trajectories for rollout evaluation
File: 1D_Burgers_Sols_Nu0.0001.hdf5
Loading from file: /data/user_data/rvk/pdebench_gen/burgers_1024_0.0001/1D_Burgers_Sols_Nu0.0001.hdf5
Original data shape: (10000, 201, 1024)
After downsampling data shape: (10000, 201, 1024)
Total data shape after sampling: (10000, 201, 1024)
Test split data shape: (1000, 201, 1024)
Extracted 1000 complete trajectories
Trajectory shapes: [torch.Size([201, 1024]), torch.Size([201, 1024]), torch.Size([201, 1024])]
Rollout test dataset created with 1000 trajectories

Final dataset sizes:
Train dataset size: 1592000
Validation dataset size: 199000
Test dataset size: 199000
Rollout test dataset size: 1000
Collected 10 examples for resolution 1024
Resolution 1024 (downsample factor: 1) - Relative L2 Loss: 0.077653
Memory cleaned after resolution 1024


Creating prediction vs target plots...
Saved prediction plot: figures/5562044/prediction_plots/burger_predictions_vs_targets_10_examples.png
Saved numerical results: figures/5562044/burger_1d_evaluation_results_20250922_062232.csv
Saved summary: figures/5562044/burger_1d_evaluation_summary_20250922_062232.txt

==================================================
BURGER EVALUATION SUMMARY
==================================================
Resolution  32: 0.038825
Resolution  64: 0.072115
Resolution 128: 0.074853
Resolution 256: 0.076863
Resolution 512: 0.077526
Resolution 1024: 0.077653
[1;34mwandb[0m: 
[1;34mwandb[0m: 🚀 View run [33mbumbling-leaf-397[0m at: [34mhttps://wandb.ai/rohanvk-carnegie-mellon-university/ffno1d/runs/nipnea4o[0m
[1;34mwandb[0m: Find logs at: [1;35mwandb/run-20250922_015638-nipnea4o/logs[0m
Job completed at Mon Sep 22 06:22:35 EDT 2025
