Job started on babel-5-27 at Wed May 28 13:28:51 EDT 2025
Job ID: 4950524
GPU information:
Wed May 28 13:28:51 2025       
+-----------------------------------------------------------------------------------------+
| NVIDIA-SMI 575.51.03              Driver Version: 575.51.03      CUDA Version: 12.9     |
|-----------------------------------------+------------------------+----------------------+
| GPU  Name                 Persistence-M | Bus-Id          Disp.A | Volatile Uncorr. ECC |
| Fan  Temp   Perf          Pwr:Usage/Cap |           Memory-Usage | GPU-Util  Compute M. |
|                                         |                        |               MIG M. |
|=========================================+========================+======================|
|   0  NVIDIA A100 80GB PCIe          On  |   00000000:41:00.0 Off |                    0 |
| N/A   36C    P0             57W /  300W |       0MiB /  81920MiB |      0%      Default |
|                                         |                        |             Disabled |
+-----------------------------------------+------------------------+----------------------+
|   1  NVIDIA A100 80GB PCIe          On  |   00000000:E1:00.0 Off |                    0 |
| N/A   31C    P0             53W /  300W |       0MiB /  81920MiB |      0%      Default |
|                                         |                        |             Disabled |
+-----------------------------------------+------------------------+----------------------+
                                                                                         
+-----------------------------------------------------------------------------------------+
| Processes:                                                                              |
|  GPU   GI   CI              PID   Type   Process name                        GPU Memory |
|        ID   ID                                                               Usage      |
|=========================================================================================|
|  No running processes found                                                             |
+-----------------------------------------------------------------------------------------+
CUDA devices:
CUDA_VISIBLE_DEVICES: 0,1
Using device: cuda
[2025-05-28 13:28:58,633][root][INFO] - model:
  _target_: models.unet.UNet2d
  in_channels: 3
  out_channels: 3
  width: 32
dataset:
  reduced_batch: 1
  reduced_resolution: 4
  reduced_resolution_t: 1
  window_size: 15
  original_res: 512
  pde: navier_stokes_0
  data_path1: data/pdebench/ns_incom_inhom_2d_512-100.hdf5
training:
  batch_size: 4
  epochs: 100
  learning_rate: 0.001
  use_normalizer: false
project_name: ${dataset.pde}_${hydra:runtime.choices.model}
checkpoint_dir: checkpoints

Project name: navier_stokes_0_unet/unet_2d
Model name: models.unet.UNet2d
PDE Dataset: navier_stokes_0
Loading from file: /home/rvk/data/pdebench/ns_incom_inhom_2d_512-100.hdf5
Available keys: ['force', 'particles', 't', 'velocity']
Velocity data shape: (4, 1000, 512, 512, 2)
Particles data shape: (4, 1000, 512, 512, 1)
Combined data shape: (4, 1000, 128, 128, 3)
x shape: torch.Size([3992, 3, 128, 128])
y shape: torch.Size([3992, 3, 128, 128])
---------Using data normalizer---------------
Train dataset size: 3193
Validation dataset size: 399
Test dataset size: 400
<class 'torch.Tensor'> -0.009442243725061417 -0.009136653505265713 1.083561897277832 1.087708592414856
Sample Input shape: torch.Size([4, 3, 128, 128])
Sample Output shape: torch.Size([4, 3, 128, 128])
UNet2d(
  (encoder1): Sequential(
    (enc1conv1): Conv2d(3, 32, kernel_size=(3, 3), stride=(1, 1), padding=(1, 1), bias=False)
    (enc1norm1): BatchNorm2d(32, eps=1e-05, momentum=0.1, affine=True, track_running_stats=True)
    (enc1tanh1): Tanh()
    (enc1conv2): Conv2d(32, 32, kernel_size=(3, 3), stride=(1, 1), padding=(1, 1), bias=False)
    (enc1norm2): BatchNorm2d(32, eps=1e-05, momentum=0.1, affine=True, track_running_stats=True)
    (enc1tanh2): Tanh()
  )
  (pool1): MaxPool2d(kernel_size=2, stride=2, padding=0, dilation=1, ceil_mode=False)
  (encoder2): Sequential(
    (enc2conv1): Conv2d(32, 64, kernel_size=(3, 3), stride=(1, 1), padding=(1, 1), bias=False)
    (enc2norm1): BatchNorm2d(64, eps=1e-05, momentum=0.1, affine=True, track_running_stats=True)
    (enc2tanh1): Tanh()
    (enc2conv2): Conv2d(64, 64, kernel_size=(3, 3), stride=(1, 1), padding=(1, 1), bias=False)
    (enc2norm2): BatchNorm2d(64, eps=1e-05, momentum=0.1, affine=True, track_running_stats=True)
    (enc2tanh2): Tanh()
  )
  (pool2): MaxPool2d(kernel_size=2, stride=2, padding=0, dilation=1, ceil_mode=False)
  (encoder3): Sequential(
    (enc3conv1): Conv2d(64, 128, kernel_size=(3, 3), stride=(1, 1), padding=(1, 1), bias=False)
    (enc3norm1): BatchNorm2d(128, eps=1e-05, momentum=0.1, affine=True, track_running_stats=True)
    (enc3tanh1): Tanh()
    (enc3conv2): Conv2d(128, 128, kernel_size=(3, 3), stride=(1, 1), padding=(1, 1), bias=False)
    (enc3norm2): BatchNorm2d(128, eps=1e-05, momentum=0.1, affine=True, track_running_stats=True)
    (enc3tanh2): Tanh()
  )
  (pool3): MaxPool2d(kernel_size=2, stride=2, padding=0, dilation=1, ceil_mode=False)
  (encoder4): Sequential(
    (enc4conv1): Conv2d(128, 256, kernel_size=(3, 3), stride=(1, 1), padding=(1, 1), bias=False)
    (enc4norm1): BatchNorm2d(256, eps=1e-05, momentum=0.1, affine=True, track_running_stats=True)
    (enc4tanh1): Tanh()
    (enc4conv2): Conv2d(256, 256, kernel_size=(3, 3), stride=(1, 1), padding=(1, 1), bias=False)
    (enc4norm2): BatchNorm2d(256, eps=1e-05, momentum=0.1, affine=True, track_running_stats=True)
    (enc4tanh2): Tanh()
  )
  (pool4): MaxPool2d(kernel_size=2, stride=2, padding=0, dilation=1, ceil_mode=False)
  (bottleneck): Sequential(
    (bottleneckconv1): Conv2d(256, 512, kernel_size=(3, 3), stride=(1, 1), padding=(1, 1), bias=False)
    (bottlenecknorm1): BatchNorm2d(512, eps=1e-05, momentum=0.1, affine=True, track_running_stats=True)
    (bottlenecktanh1): Tanh()
    (bottleneckconv2): Conv2d(512, 512, kernel_size=(3, 3), stride=(1, 1), padding=(1, 1), bias=False)
    (bottlenecknorm2): BatchNorm2d(512, eps=1e-05, momentum=0.1, affine=True, track_running_stats=True)
    (bottlenecktanh2): Tanh()
  )
  (upconv4): ConvTranspose2d(512, 256, kernel_size=(2, 2), stride=(2, 2))
  (decoder4): Sequential(
    (dec4conv1): Conv2d(512, 256, kernel_size=(3, 3), stride=(1, 1), padding=(1, 1), bias=False)
    (dec4norm1): BatchNorm2d(256, eps=1e-05, momentum=0.1, affine=True, track_running_stats=True)
    (dec4tanh1): Tanh()
    (dec4conv2): Conv2d(256, 256, kernel_size=(3, 3), stride=(1, 1), padding=(1, 1), bias=False)
    (dec4norm2): BatchNorm2d(256, eps=1e-05, momentum=0.1, affine=True, track_running_stats=True)
    (dec4tanh2): Tanh()
  )
  (upconv3): ConvTranspose2d(256, 128, kernel_size=(2, 2), stride=(2, 2))
  (decoder3): Sequential(
    (dec3conv1): Conv2d(256, 128, kernel_size=(3, 3), stride=(1, 1), padding=(1, 1), bias=False)
    (dec3norm1): BatchNorm2d(128, eps=1e-05, momentum=0.1, affine=True, track_running_stats=True)
    (dec3tanh1): Tanh()
    (dec3conv2): Conv2d(128, 128, kernel_size=(3, 3), stride=(1, 1), padding=(1, 1), bias=False)
    (dec3norm2): BatchNorm2d(128, eps=1e-05, momentum=0.1, affine=True, track_running_stats=True)
    (dec3tanh2): Tanh()
  )
  (upconv2): ConvTranspose2d(128, 64, kernel_size=(2, 2), stride=(2, 2))
  (decoder2): Sequential(
    (dec2conv1): Conv2d(128, 64, kernel_size=(3, 3), stride=(1, 1), padding=(1, 1), bias=False)
    (dec2norm1): BatchNorm2d(64, eps=1e-05, momentum=0.1, affine=True, track_running_stats=True)
    (dec2tanh1): Tanh()
    (dec2conv2): Conv2d(64, 64, kernel_size=(3, 3), stride=(1, 1), padding=(1, 1), bias=False)
    (dec2norm2): BatchNorm2d(64, eps=1e-05, momentum=0.1, affine=True, track_running_stats=True)
    (dec2tanh2): Tanh()
  )
  (upconv1): ConvTranspose2d(64, 32, kernel_size=(2, 2), stride=(2, 2))
  (decoder1): Sequential(
    (dec1conv1): Conv2d(64, 32, kernel_size=(3, 3), stride=(1, 1), padding=(1, 1), bias=False)
    (dec1norm1): BatchNorm2d(32, eps=1e-05, momentum=0.1, affine=True, track_running_stats=True)
    (dec1tanh1): Tanh()
    (dec1conv2): Conv2d(32, 32, kernel_size=(3, 3), stride=(1, 1), padding=(1, 1), bias=False)
    (dec1norm2): BatchNorm2d(32, eps=1e-05, momentum=0.1, affine=True, track_running_stats=True)
    (dec1tanh2): Tanh()
  )
  (conv): Conv2d(32, 3, kernel_size=(1, 1), stride=(1, 1))
)
Epoch 0, Train Loss: 0.24245506, Val Loss: 0.18369450
Epoch 10, Train Loss: 0.06693620, Val Loss: 0.06881711
Epoch 20, Train Loss: 0.05110300, Val Loss: 0.05059346
Epoch 30, Train Loss: 0.04369648, Val Loss: 0.04514251
Epoch 40, Train Loss: 0.03859622, Val Loss: 0.03845701
Epoch 50, Train Loss: 0.03474932, Val Loss: 0.04696695
Epoch 60, Train Loss: 0.03094417, Val Loss: 0.03741921
Epoch 70, Train Loss: 0.02932130, Val Loss: 0.05190218
Epoch 80, Train Loss: 0.02796847, Val Loss: 0.04813699
Epoch 90, Train Loss: 0.02726200, Val Loss: 0.03997726
Test L2 Loss: 0.015312
Model saved to checkpoints/unet2d/navier_stokes_0_4950524.pt
Original test data shape: x=torch.Size([400, 3, 128, 128]), y=torch.Size([400, 3, 128, 128])

Evaluating at resolution factor: 1
Resolution factor 1 - Relative L2 Loss: 0.015036

Evaluating at resolution factor: 2
Downsampled shapes: x=torch.Size([400, 3, 64, 64]), y=torch.Size([400, 3, 64, 64])
Resolution factor 2 - Relative L2 Loss: 0.068685

Evaluating at resolution factor: 4
Downsampled shapes: x=torch.Size([400, 3, 32, 32]), y=torch.Size([400, 3, 32, 32])
Resolution factor 4 - Relative L2 Loss: 0.125278

Evaluating at resolution factor: 8
Downsampled shapes: x=torch.Size([400, 3, 16, 16]), y=torch.Size([400, 3, 16, 16])
Resolution factor 8 - Relative L2 Loss: 0.221600

Evaluating at resolution factor: 16
Downsampled shapes: x=torch.Size([400, 3, 8, 8]), y=torch.Size([400, 3, 8, 8])
Skipping Resolution factor 16 because not enough modes

Evaluating at resolution factor: 32
Downsampled shapes: x=torch.Size([400, 3, 4, 4]), y=torch.Size([400, 3, 4, 4])
Skipping Resolution factor 32 because not enough modes
Loading from file: /home/rvk/data/pdebench/ns_incom_inhom_2d_512-100.hdf5
Available keys: ['force', 'particles', 't', 'velocity']
Velocity data shape: (4, 1000, 512, 512, 2)
Particles data shape: (4, 1000, 512, 512, 1)
Combined data shape: (4, 1000, 512, 512, 3)
x shape: torch.Size([3992, 3, 512, 512])
y shape: torch.Size([3992, 3, 512, 512])
---------Using data normalizer---------------
Train dataset size: 3193
Validation dataset size: 399
Test dataset size: 400
Original test data shape: x=torch.Size([400, 3, 512, 512]), y=torch.Size([400, 3, 512, 512])
Testing resolutions: [256, 512]

Evaluating at resolution: 256
Downsampled shapes: x=torch.Size([400, 3, 256, 256]), y=torch.Size([400, 3, 256, 256])
Resolution 256 - Relative L2 Loss: 0.046571

Evaluating at resolution: 512
Downsampled shapes: x=torch.Size([400, 3, 512, 512]), y=torch.Size([400, 3, 512, 512])
Resolution 512 - Relative L2 Loss: 0.046740

Summary of Super-Resolution Evaluation:
Resolution factor 1: Relative L2 Loss = 0.015036
Resolution factor 2: Relative L2 Loss = 0.068685
Resolution factor 4: Relative L2 Loss = 0.125278
Resolution factor 8: Relative L2 Loss = 0.221600

Summary of Higher-Resolution Evaluation:
Resolution 256: Relative L2 Loss = 0.046571
Resolution 512: Relative L2 Loss = 0.046740
[1;34mwandb[0m: 
[1;34mwandb[0m: 🚀 View run [33msmooth-plasma-4[0m at: [34mhttps://wandb.ai/rohanvk-carnegie-mellon-university/unet2d/runs/mc6qrfbm[0m
[1;34mwandb[0m: Find logs at: [1;35mwandb/run-20250528_133004-mc6qrfbm/logs[0m
Job completed at Wed May 28 14:03:33 EDT 2025
