Job started on babel-6-21 at Tue Apr 15 21:44:56 EDT 2025
Job ID: 4577380
GPU information:
Tue Apr 15 21:44:56 2025       
+-----------------------------------------------------------------------------------------+
| NVIDIA-SMI 560.35.03              Driver Version: 560.35.03      CUDA Version: 12.6     |
|-----------------------------------------+------------------------+----------------------+
| GPU  Name                 Persistence-M | Bus-Id          Disp.A | Volatile Uncorr. ECC |
| Fan  Temp   Perf          Pwr:Usage/Cap |           Memory-Usage | GPU-Util  Compute M. |
|                                         |                        |               MIG M. |
|=========================================+========================+======================|
|   0  NVIDIA RTX A6000               On  |   00000000:41:00.0 Off |                  Off |
| 30%   37C    P8             23W /  210W |       2MiB /  49140MiB |      0%      Default |
|                                         |                        |                  N/A |
+-----------------------------------------+------------------------+----------------------+
|   1  NVIDIA RTX A6000               On  |   00000000:61:00.0 Off |                  Off |
| 30%   37C    P8             27W /  210W |       2MiB /  49140MiB |      0%      Default |
|                                         |                        |                  N/A |
+-----------------------------------------+------------------------+----------------------+
                                                                                         
+-----------------------------------------------------------------------------------------+
| Processes:                                                                              |
|  GPU   GI   CI        PID   Type   Process name                              GPU Memory |
|        ID   ID                                                               Usage      |
|=========================================================================================|
|  No running processes found                                                             |
+-----------------------------------------------------------------------------------------+
CUDA devices:
CUDA_VISIBLE_DEVICES: 0,1
Using device: cuda
[2025-04-15 21:45:01,819][root][INFO] - model:
  _target_: models.unet.UNet1d
  in_channels: 1
  out_channels: 1
  width: 32
dataset:
  reduced_batch: 1
  reduced_resolution: 4
  reduced_resolution_t: 4
  window_size: 15
  original_res: 1024
  current_res: 256
  pde:
  - burger_0.001
  - burger_0.01
  - burger_0.1
  - burger_1.0
  - burger_2.0
  - burger_4.0
  data_path1:
  - data/pdebench/1D_Burgers_Sols_Nu0.001.hdf5
  - data/pdebench/1D_Burgers_Sols_Nu0.01.hdf5
  - data/pdebench/1D_Burgers_Sols_Nu0.1.hdf5
  - data/pdebench/1D_Burgers_Sols_Nu1.0.hdf5
  - data/pdebench/1D_Burgers_Sols_Nu2.0.hdf5
  - data/pdebench/1D_Burgers_Sols_Nu4.0.hdf5
  test_id:
  - 4552621
  - 4552622
  - 4552623
  - 4552624
  - 4552626
  - 4552627
training:
  batch_size: 64
  epochs: 100
  learning_rate: 0.001
  use_normalizer: false
project_name: ${dataset.pde}_${hydra:runtime.choices.model}
checkpoint_dir: checkpoints

Project name: ['burger_0.001', 'burger_0.01', 'burger_0.1', 'burger_1.0', 'burger_2.0', 'burger_4.0']_unet/unet_1d
Model name: models.unet.UNet1d
PDE Dataset: ['burger_0.001', 'burger_0.01', 'burger_0.1', 'burger_1.0', 'burger_2.0', 'burger_4.0']
UNet1d(
  (encoder1): Sequential(
    (enc1conv1): Conv1d(1, 32, kernel_size=(3,), stride=(1,), padding=(1,), bias=False)
    (enc1norm1): BatchNorm1d(32, eps=1e-05, momentum=0.1, affine=True, track_running_stats=True)
    (enc1tanh1): Tanh()
    (enc1conv2): Conv1d(32, 32, kernel_size=(3,), stride=(1,), padding=(1,), bias=False)
    (enc1norm2): BatchNorm1d(32, eps=1e-05, momentum=0.1, affine=True, track_running_stats=True)
    (enc1tanh2): Tanh()
  )
  (pool1): MaxPool1d(kernel_size=2, stride=2, padding=0, dilation=1, ceil_mode=False)
  (encoder2): Sequential(
    (enc2conv1): Conv1d(32, 64, kernel_size=(3,), stride=(1,), padding=(1,), bias=False)
    (enc2norm1): BatchNorm1d(64, eps=1e-05, momentum=0.1, affine=True, track_running_stats=True)
    (enc2tanh1): Tanh()
    (enc2conv2): Conv1d(64, 64, kernel_size=(3,), stride=(1,), padding=(1,), bias=False)
    (enc2norm2): BatchNorm1d(64, eps=1e-05, momentum=0.1, affine=True, track_running_stats=True)
    (enc2tanh2): Tanh()
  )
  (pool2): MaxPool1d(kernel_size=2, stride=2, padding=0, dilation=1, ceil_mode=False)
  (encoder3): Sequential(
    (enc3conv1): Conv1d(64, 128, kernel_size=(3,), stride=(1,), padding=(1,), bias=False)
    (enc3norm1): BatchNorm1d(128, eps=1e-05, momentum=0.1, affine=True, track_running_stats=True)
    (enc3tanh1): Tanh()
    (enc3conv2): Conv1d(128, 128, kernel_size=(3,), stride=(1,), padding=(1,), bias=False)
    (enc3norm2): BatchNorm1d(128, eps=1e-05, momentum=0.1, affine=True, track_running_stats=True)
    (enc3tanh2): Tanh()
  )
  (pool3): MaxPool1d(kernel_size=2, stride=2, padding=0, dilation=1, ceil_mode=False)
  (encoder4): Sequential(
    (enc4conv1): Conv1d(128, 256, kernel_size=(3,), stride=(1,), padding=(1,), bias=False)
    (enc4norm1): BatchNorm1d(256, eps=1e-05, momentum=0.1, affine=True, track_running_stats=True)
    (enc4tanh1): Tanh()
    (enc4conv2): Conv1d(256, 256, kernel_size=(3,), stride=(1,), padding=(1,), bias=False)
    (enc4norm2): BatchNorm1d(256, eps=1e-05, momentum=0.1, affine=True, track_running_stats=True)
    (enc4tanh2): Tanh()
  )
  (pool4): MaxPool1d(kernel_size=2, stride=2, padding=0, dilation=1, ceil_mode=False)
  (bottleneck): Sequential(
    (bottleneckconv1): Conv1d(256, 512, kernel_size=(3,), stride=(1,), padding=(1,), bias=False)
    (bottlenecknorm1): BatchNorm1d(512, eps=1e-05, momentum=0.1, affine=True, track_running_stats=True)
    (bottlenecktanh1): Tanh()
    (bottleneckconv2): Conv1d(512, 512, kernel_size=(3,), stride=(1,), padding=(1,), bias=False)
    (bottlenecknorm2): BatchNorm1d(512, eps=1e-05, momentum=0.1, affine=True, track_running_stats=True)
    (bottlenecktanh2): Tanh()
  )
  (upconv4): ConvTranspose1d(512, 256, kernel_size=(2,), stride=(2,))
  (decoder4): Sequential(
    (dec4conv1): Conv1d(512, 256, kernel_size=(3,), stride=(1,), padding=(1,), bias=False)
    (dec4norm1): BatchNorm1d(256, eps=1e-05, momentum=0.1, affine=True, track_running_stats=True)
    (dec4tanh1): Tanh()
    (dec4conv2): Conv1d(256, 256, kernel_size=(3,), stride=(1,), padding=(1,), bias=False)
    (dec4norm2): BatchNorm1d(256, eps=1e-05, momentum=0.1, affine=True, track_running_stats=True)
    (dec4tanh2): Tanh()
  )
  (upconv3): ConvTranspose1d(256, 128, kernel_size=(2,), stride=(2,))
  (decoder3): Sequential(
    (dec3conv1): Conv1d(256, 128, kernel_size=(3,), stride=(1,), padding=(1,), bias=False)
    (dec3norm1): BatchNorm1d(128, eps=1e-05, momentum=0.1, affine=True, track_running_stats=True)
    (dec3tanh1): Tanh()
    (dec3conv2): Conv1d(128, 128, kernel_size=(3,), stride=(1,), padding=(1,), bias=False)
    (dec3norm2): BatchNorm1d(128, eps=1e-05, momentum=0.1, affine=True, track_running_stats=True)
    (dec3tanh2): Tanh()
  )
  (upconv2): ConvTranspose1d(128, 64, kernel_size=(2,), stride=(2,))
  (decoder2): Sequential(
    (dec2conv1): Conv1d(128, 64, kernel_size=(3,), stride=(1,), padding=(1,), bias=False)
    (dec2norm1): BatchNorm1d(64, eps=1e-05, momentum=0.1, affine=True, track_running_stats=True)
    (dec2tanh1): Tanh()
    (dec2conv2): Conv1d(64, 64, kernel_size=(3,), stride=(1,), padding=(1,), bias=False)
    (dec2norm2): BatchNorm1d(64, eps=1e-05, momentum=0.1, affine=True, track_running_stats=True)
    (dec2tanh2): Tanh()
  )
  (upconv1): ConvTranspose1d(64, 32, kernel_size=(2,), stride=(2,))
  (decoder1): Sequential(
    (dec1conv1): Conv1d(64, 32, kernel_size=(3,), stride=(1,), padding=(1,), bias=False)
    (dec1norm1): BatchNorm1d(32, eps=1e-05, momentum=0.1, affine=True, track_running_stats=True)
    (dec1tanh1): Tanh()
    (dec1conv2): Conv1d(32, 32, kernel_size=(3,), stride=(1,), padding=(1,), bias=False)
    (dec1norm2): BatchNorm1d(32, eps=1e-05, momentum=0.1, affine=True, track_running_stats=True)
    (dec1tanh2): Tanh()
  )
  (conv): Conv1d(32, 1, kernel_size=(1,), stride=(1,))
)
----------------------------------------------------------
Evaluating job_id:4552621
Loading data path: data/pdebench/1D_Burgers_Sols_Nu0.001.hdf5
Loading model path: ./checkpoints/unet1d/burger_0.001_4552621.pt
----------------------------------------------------------
Loading from file: /home/rvk/data/pdebench/1D_Burgers_Sols_Nu0.001.hdf5
(10000, 201, 1024)
Total data shape: (10000, 51, 1024)
x shape: (490000, 1, 1024)
y shape: (490000, 1, 1024)
grid shape: torch.Size([1024, 1])
---------Using data normalizer---------------
Train dataset size: 392000
Validation dataset size: 49000
Test dataset size: 49000
Original test data shape: x=torch.Size([49000, 1, 1024]), y=torch.Size([49000, 1, 1024])
Testing resolutions: [512, 1024]

Evaluating at resolution: 512
Downsampled shapes: x=torch.Size([49000, 1, 512]), y=torch.Size([49000, 1, 512])
Resolution 512 - Relative L2 Loss: 0.105888

Evaluating at resolution: 1024
Downsampled shapes: x=torch.Size([49000, 1, 1024]), y=torch.Size([49000, 1, 1024])
Resolution 1024 - Relative L2 Loss: 0.137133
----------------------------------------------------------
Evaluating job_id:4552622
Loading data path: data/pdebench/1D_Burgers_Sols_Nu0.01.hdf5
Loading model path: ./checkpoints/unet1d/burger_0.01_4552622.pt
----------------------------------------------------------
Loading from file: /home/rvk/data/pdebench/1D_Burgers_Sols_Nu0.01.hdf5
(10000, 201, 1024)
Total data shape: (10000, 51, 1024)
x shape: (490000, 1, 1024)
y shape: (490000, 1, 1024)
grid shape: torch.Size([1024, 1])
---------Using data normalizer---------------
Train dataset size: 392000
Validation dataset size: 49000
Test dataset size: 49000
Original test data shape: x=torch.Size([49000, 1, 1024]), y=torch.Size([49000, 1, 1024])
Testing resolutions: [512, 1024]

Evaluating at resolution: 512
Downsampled shapes: x=torch.Size([49000, 1, 512]), y=torch.Size([49000, 1, 512])
Resolution 512 - Relative L2 Loss: 0.056761

Evaluating at resolution: 1024
Downsampled shapes: x=torch.Size([49000, 1, 1024]), y=torch.Size([49000, 1, 1024])
Resolution 1024 - Relative L2 Loss: 0.074765
----------------------------------------------------------
Evaluating job_id:4552623
Loading data path: data/pdebench/1D_Burgers_Sols_Nu0.1.hdf5
Loading model path: ./checkpoints/unet1d/burger_0.1_4552623.pt
----------------------------------------------------------
Loading from file: /home/rvk/data/pdebench/1D_Burgers_Sols_Nu0.1.hdf5
(10000, 201, 1024)
Total data shape: (10000, 51, 1024)
x shape: (490000, 1, 1024)
y shape: (490000, 1, 1024)
grid shape: torch.Size([1024, 1])
---------Using data normalizer---------------
Train dataset size: 392000
Validation dataset size: 49000
Test dataset size: 49000
Original test data shape: x=torch.Size([49000, 1, 1024]), y=torch.Size([49000, 1, 1024])
Testing resolutions: [512, 1024]

Evaluating at resolution: 512
Downsampled shapes: x=torch.Size([49000, 1, 512]), y=torch.Size([49000, 1, 512])
Resolution 512 - Relative L2 Loss: 0.050845

Evaluating at resolution: 1024
Downsampled shapes: x=torch.Size([49000, 1, 1024]), y=torch.Size([49000, 1, 1024])
Resolution 1024 - Relative L2 Loss: 0.054854
----------------------------------------------------------
Evaluating job_id:4552624
Loading data path: data/pdebench/1D_Burgers_Sols_Nu1.0.hdf5
Loading model path: ./checkpoints/unet1d/burger_1.0_4552624.pt
----------------------------------------------------------
Loading from file: /home/rvk/data/pdebench/1D_Burgers_Sols_Nu1.0.hdf5
(10000, 201, 1024)
Total data shape: (10000, 51, 1024)
x shape: (490000, 1, 1024)
y shape: (490000, 1, 1024)
grid shape: torch.Size([1024, 1])
---------Using data normalizer---------------
Train dataset size: 392000
Validation dataset size: 49000
Test dataset size: 49000
Original test data shape: x=torch.Size([49000, 1, 1024]), y=torch.Size([49000, 1, 1024])
Testing resolutions: [512, 1024]

Evaluating at resolution: 512
Downsampled shapes: x=torch.Size([49000, 1, 512]), y=torch.Size([49000, 1, 512])
Resolution 512 - Relative L2 Loss: 0.076073

Evaluating at resolution: 1024
Downsampled shapes: x=torch.Size([49000, 1, 1024]), y=torch.Size([49000, 1, 1024])
Resolution 1024 - Relative L2 Loss: 0.076472
----------------------------------------------------------
Evaluating job_id:4552626
Loading data path: data/pdebench/1D_Burgers_Sols_Nu2.0.hdf5
Loading model path: ./checkpoints/unet1d/burger_2.0_4552626.pt
----------------------------------------------------------
Loading from file: /home/rvk/data/pdebench/1D_Burgers_Sols_Nu2.0.hdf5
(10000, 201, 1024)
Total data shape: (10000, 51, 1024)
x shape: (490000, 1, 1024)
y shape: (490000, 1, 1024)
grid shape: torch.Size([1024, 1])
---------Using data normalizer---------------
Train dataset size: 392000
Validation dataset size: 49000
Test dataset size: 49000
Original test data shape: x=torch.Size([49000, 1, 1024]), y=torch.Size([49000, 1, 1024])
Testing resolutions: [512, 1024]

Evaluating at resolution: 512
Downsampled shapes: x=torch.Size([49000, 1, 512]), y=torch.Size([49000, 1, 512])
Resolution 512 - Relative L2 Loss: 0.204542

Evaluating at resolution: 1024
Downsampled shapes: x=torch.Size([49000, 1, 1024]), y=torch.Size([49000, 1, 1024])
Resolution 1024 - Relative L2 Loss: 0.204572
----------------------------------------------------------
Evaluating job_id:4552627
Loading data path: data/pdebench/1D_Burgers_Sols_Nu4.0.hdf5
Loading model path: ./checkpoints/unet1d/burger_4.0_4552627.pt
----------------------------------------------------------
Loading from file: /home/rvk/data/pdebench/1D_Burgers_Sols_Nu4.0.hdf5
(10000, 201, 1024)
Total data shape: (10000, 51, 1024)
x shape: (490000, 1, 1024)
y shape: (490000, 1, 1024)
grid shape: torch.Size([1024, 1])
---------Using data normalizer---------------
Train dataset size: 392000
Validation dataset size: 49000
Test dataset size: 49000
Original test data shape: x=torch.Size([49000, 1, 1024]), y=torch.Size([49000, 1, 1024])
Testing resolutions: [512, 1024]

Evaluating at resolution: 512
Downsampled shapes: x=torch.Size([49000, 1, 512]), y=torch.Size([49000, 1, 512])
Resolution 512 - Relative L2 Loss: 0.110513

Evaluating at resolution: 1024
Downsampled shapes: x=torch.Size([49000, 1, 1024]), y=torch.Size([49000, 1, 1024])
Resolution 1024 - Relative L2 Loss: 0.110008

Summary of Higher-Resolution Evaluation:
Resolution 512: Relative L2 Loss = 0.110513
Resolution 1024: Relative L2 Loss = 0.110008
[1;34mwandb[0m: 
[1;34mwandb[0m: 🚀 View run [33mwarm-jazz-9[0m at: [34mhttps://wandb.ai/rohanvk-carnegie-mellon-university/FFNO%20Test%20Resolution/runs/u0iy4ar5[0m
[1;34mwandb[0m: Find logs at: [1;35mwandb/run-20250415_214503-u0iy4ar5/logs[0m
Job completed at Tue Apr 15 21:49:15 EDT 2025
